tconst,review
tt0499603,"After I watched this movie, I came to IMDb and read some of the reviews, which compared it to Lost In Translation LITE. When I read that I immediately could see the reviewers point.<br /><br />This movie was a poor attempt at a similar theme. Interestingly, the format of the movie is nearly identical, but the PACING is incredibly different. ""10 Items"" rushes the viewer through the 1-day time line of the movie, whereas the better-planned ""Lost In..."" seems to stretch out over a few long days.<br /><br />I'm sure some people will see this because it has Morgan Freeman, and will be disappointed. It seems his better roles now-a-days are supporting roles in big blockbusters, rather than leading roles in sub-$10mil limited release movies and indie films."
tt0840094,"If you don't mind having your emotions toyed with, then you won't mind this movie. On the other hand, if you enjoy British crime mysteries, following clues and seeing how they all logically fall into place at the end, you'll be very disappointed.<br /><br />Here are some of the logical inconsistencies that lead to that disappointment: <br /><br />* While the police utilize the CCTV cameras early on to gather clues about the mystery, the huge truck that stopped and blocked the children's view just before her disappearance doesn't get caught on camera. This is a critical piece of the mystery. It's inconsistent to have the car the children were in caught on camera and not the big truck that is so critical to the mystery.<br /><br />* The movie goes to great lengths to show the sophistication of the equipment in tracking down the children's movements but misses the opportunity to utilize the same sophisticated equipment is tracking down vehicles that may have entered the crime scene from camera-visible locations adjacent to the crime scene as part of developing clues.<br /><br />* In England, driving is on the left. The director goes out of his way to have the car at the crime scene park on the right, several meters away from the flower kiosk, when it could have easily parked immediately behind, or even on the side; as the huge truck did.<br /><br />* The police forensics team is so meticulous as to find a discarded cell phone in a sewer drain several miles from the scene of the crime, but can't find any blood evidence from the head injury right at the crime scene, even though they secured the scene just hours after the disappearance and with no intervening rainfall.<br /><br />* Search dogs were not used at all to find the missing children; this from the country that is well known for developing the hound dog for search and hunting.<br /><br />* It is illogical that such a highly publicized news story would not turn up the presumably innocent truck driver that stopped at the flower kiosk.<br /><br />* It is illogical that the mother would go to such extremes and expend so much effort to leave carpet fiber clues under her fingernails for her eventual murder investigators even coaxing her daughter to do the same-- while she simply could not have crawled out of the unguarded mobile home. If she had enough sense about her to ask her daughter to get carpet fibers under her nails, she could of just as easily asked her daughter to call out for help or even leave the mobile home that was in a crowded residential park.<br /><br />* The suspect that abducted the little girl was portrayed as mentally slow/dimwitted --justifying his unknowingly drowning of the mother but, he was smart enough not to cooperate with the police and also fully exercise his rights not to self-incriminate.<br /><br />There are more inconsistencies like this that will lead to a true sleuth aficionado's disappointment. 'Five Days' is a very weak British crime story."
tt0887971,"My, how the mighty have fallen. Kim Basinger is a great actress but she was definitely slumming when she took this role. This movie is bad for one reason in particular: lapses in logic. Its looks like one of those movies that would have been passable with all its plot holes if it had came out in the 80s and 90s but in 2008 it just looks real stupid. This is the worst thriller I've ever seen and I've seen The Bone Collector and Twisted.<br /><br />The story details Della(Kim Basinger)is just getting from buying gifts in a mall an is harassed by a gang of thugs that end up killing a cop that came to her aid. From then on she is chased by these idiotic goons through an abandoned street and she gets rid of them one by one with a toolbox full of tools.<br /><br />So many things are wrong with this movie. As I said this movie leaps over logic at every turn and with the exception of Kim Basinger, the acting is made-for-TV bad. Hell, this pseudo thriller is made-for-TV bad. The way she kills each of these politically correct thugs(1 Caucasian, 1 Hispanic, 1 Asian and 1 African American all coming together to stalk a Caucasian woman. Don't you just love America?)is laughable to a fault. The way she killed the Hispanic guy made me laugh hysterically. The sex scene with the main hoodlum was so out in left field that it make you shake your head in shame. I only recommend this to lovers of bad films and no one else. Anybody else especially Kim Basinger fans would do well not to own this flick. You don't want see an actress you respect in a film this bad now do you? Of course not. You were warned."
tt0022150,"This is so exciting! After I saw ""La Roue"" this afternoon, a short, light-hearted little movie, I consider this one a real treat! This is absolutely delightful and one of the most charming pictures I saw this year. It is the more amazing since it is an early talkie and puts some great pictures of the 30's to shame due to its innovative use of sound in cinema. It's simply filled with music and an adorable mood that's really upbeat and, bottom line, it made me happy! Obviously it wouldn't be so difficult to retrieve the lottery ticket the male lead was looking for, but the pace is so exhilarating and the movie is so spectacularly entertaining that I didn't even think of it twice. The comedy is many times hilarious and I think it is even superior to the Marx Brothers, possibly the biggest comedic force of the time. This is rather perfect."
tt0025529,"Mitchell Leisen's fifth feature as director, and he shows his versatility by directing a musical, after his previous movies were heavy dramas. He also plays a cameo as the conductor.<br /><br />You can tell it is a pre code movie, and nothing like it was made in the US for quite a while afterwards (like 30+ years). Leisen shot the musical numbers so they were like what the audience would see - no widescreen shots or from above ala Busby Berkeley. What I do find funny or interesting is that you never actually see the audience.<br /><br />As others have mentioned the leads are fairly characterless, and Jack Oakie and Victor McLaghlan play their normal movie personas. Gertrude Michael however provides a bit of spark.<br /><br />The musical numbers are interesting and some good (the Rape of the Rhapsody in particular is amusing) but the drama unconvincing and faked - three murders is too many and have minimal emotional impact on the characters. This is where this movie could have been a lot better."
tt0028057,"This is te cartoon that should have won instead of Country Cousin. Visually well-done and much more entertaining and memorable. Worth watching just for the music alone! Although there are elements that undoubtably will bruise the sensibilities of some these days, the cartoon has to be given a bit of perspective. It's over sixty years old and it is, after all, just a cartoon. I'm disabled and if I were as hyper-sensitive as the folks who look at things like this cartoon and take umbrage, I would have long since curled up in a fetal position and faded away. Sometimes you need to lighten up, put your head back and float! Caricatures of celebrities in cartoons were common in the 1930s and 1940s and were almost never terribly flattering. Bing Crosby reportedly hated it when he was used on more than one occasion. *SIGH*"
tt0032155,"Sure it was well shot and made, very well shot and made! But the story was just so weak. And the portrayal of Lincoln was even weaker. Not that Henry Fonda wasn't good but the character he played was nothing but a loon. Do you mean to tell me that Lincoln was a wise cracking smart ass with no respect of the law or the court. I mean who the hell was he supposed to be? Cousin Vinnie? I mean come on, ""I'll just call you Jackass then""???? I understand that Ford was going for great funny hero guy but I didn't really like this guy at all. He cheats in sports, talks like a real sweet simpleton and does not seem to know were to sit in a courtroom. How am I supposed to take this seriously.<br /><br />The twist was even weaker. I mean come on! That was just stupid. The whole story seemed like it was thought up by some 5 year old in his or her dreams. Saying that I liked it enough, it was very entertaining and made me laugh at several occasions so I can't say it's a bad film. In fact I must say that I must say it's good enough, nothing that entertains me and makes me laugh can be bad BUT this vivid and silly story was just so ridiculous that I can't understand how anyone could consider it great.<br /><br />I have no idea how historically accurate this film was but if any of it was true I would really have to shake my head."
tt0034613,"A number of brides are mysteriously murdered while at the altar, and later their bodies are stolen en route to the morgue. Newspaper writer Patricia Hunter decides to investigate these mysterious killings. She discovers that right before each ceremony, the bride was given a rare orchid (supposedly from the groom) which contained a powerful drug that succumbed them. Patricia is told that the orchid was first grown by a Dr. Lorenz, who lives in a secluded estate, with his wife. In reality, Dr. Lorenz is responsible for the crimes, by putting the brides in a suspended state, and using their gland fluid to keep his wife eternally young. Patricia, along with Dr. Foster (who is working with Dr. Lorenz on the medical mystery surrounding his wife) try to force Dr. Lorenz's hand by setting up a phony wedding, which eventually leads Patricia into the mad doctor's clutches. This movie had a very good opening reel, but basically ended up with too many establishing shots and other weak scenes. The cast is decent, Walters and Coffin deserved better, but that's life. Russell steals the show (even out hamming Lugosi- who does not give one of his more memorable performances, even considering his Monograms) as Countess Lorenz playing the role with the qualities of many of the stereotypical characteristics of many of today's Hollywood prima donnas. Weak and contrived ending as well. Rating, based on B movies, 4."
tt0040907,"This film seems to be well remembered as the time Tom & Jerry signed a peace treaty. Things are idyllic for a time but, predictably, it goes sour. Probably the most memorable moment was the endless fight involving a pipe, a frying pan, and a baseball bat that the two plus Butch the dog engage in at the beginning and end of the short. I enjoyed one a bunch and you should try to catch it on Cartoon Network."
tt0063385,"First off, I'd like to make a correction on another review of this film which said that the last musical to win the Best Picture Academy Award was 'Gigi' in 1958. That is misinformation as 'West Side Story' won in 1962, 'My Fair Lady' won in 1965 and 'Sound of Music' won the year after that. That said, this film is absolutely fantastic! The story from the novel has been somewhat altered, but that's more because of the limitations that they had on a stage that they just didn't change back for a filmed version. However, I don't mind. In fact, I rather think the whole production flows better than the novel does. I like Nancy bringing Oliver to the bridge with her and being killed there instead of later in the apartment. The subtle things in this film are the ones that make me laugh. I love the moment Mr. Bumble and Mrs. Bumble start coming out at the beginning from the governors office. The underscore for that moment is brilliant. My three favorite actors for this film were Jack Wild, who plays the best Dodger in any film version of the story, Ron Moody, a playful and humorous Fagin (this character is worked out much better than he is in the book), and Shani Wallis, who is the strongest, most distressed version of Nancy. The only reason I'm giving this film a 9 instead of a 10 is because of the two big production numbers which are 'Concider Yourself' and 'Who Will Buy.' I always hate when the choreography in musicals in meant to look like people doing everyday chores and jobs. It looks awful and cheesy, especially when they're dancing at the London Meat Co. They should've just done regular choreography for these scenes. However, this film is a rare treasure that will stay with us, hopefully, forever."
tt0076191,"A truly unpleasant film. While Rick Baker's special effects are quite impressive (if stomach-turning), it has no other redeeming features. Like many 70s movies, it leaves you feeling as if you need to take a long shower, and scrub the slime off of yourself. The characters are uniformly unpleasant, and plot makes no sense."
tt0079672,"Beautiful film, pure Cassavetes style. Gena Rowland gives a stunning performance of a declining actress, dealing with success, aging, loneliness...and alcoholism. She tries to escape her own subconscious ghosts, embodied by the death spectre of a young girl. Acceptance of oneself, of human condition, though its overall difficulties, is the real purpose of the film. The parallel between the theatrical sequences and the film itself are puzzling: it's like if the stage became a way out for the Heroin. If all american movies could only be that top-quality, dealing with human relations on an adult level, not trying to infantilize and standardize feelings... One of the best dramas ever. 10/10."
tt0086250,"Every great gangster movie has under-currents of human drama. Don't expect an emotional story of guilt, retribution and despair from ""Scarface"". This is a tale of ferocious greed, corruption, and power. The darker side of the fabled ""American Dream"".<br /><br />Anybody complaining about the ""cheesiness"" of this film is missing the point. The superficial characters, cheesy music, and dated fashions further fuel the criticism of this life of diabolical excess. Nothing in the lives of these characters really matter, not on any human level at least. In fact the film practically borderlines satire, ironic considering all the gangsta rappers that were positively inspired by the lifestyle of Tony Montana.<br /><br />This isn't Brian DePalma's strongest directorial effort, it is occasionally excellent and well-handled (particularly the memorable finale), but frequently sinks to sloppy and misled. Thankfully, it is supported by a very strong script by Oliver Stone (probably good therapy for him, considering the coke habit he was tackling at the time). The themes are consistent, with the focus primarily on the life of Tony Montana, and the evolution of his character as he is consumed by greed and power. The dialogue is also excellent, see-sawing comfortably between humour and drama. There are many stand-out lines, which have since wormed their way into popular culture in one form or another.<br /><br />The cast help make it what it is as well, but this is really Pacino's film. One of his earlier less subtle performances (something much more common from him nowadays), this is a world entirely separate from Michael Corleone and Frank Serpico. Yet he is as watchable here as ever, in very entertaining (and intentionally over-the-top) form. It is hard to imagine another Tony Montana after seeing this film, in possibly one of the most mimicked performances ever. Pfeiffer stood out as dull and uncomfortable on first viewing, but I've come to realize how she plays out the part of the bored little wife. Not an exceptional effort, but unfairly misjudged. The supporting players are very good too, particularly Paul Shenar as the suave Alejandro Sosa.<br /><br />Powerful, occasionally humorous, sometimes shocking, and continually controversial. ""Scarface"" is one of the films of the eighties (whatever that might mean to you). An essential and accessible gangster flick, and a pop-culture landmark. 9/10"
tt0087499,"You can never have seen either film and still know that The Jerk Too is a disaster. The question is not, ""How did it get made,"" because if you throw money at anyone and tell them to make a film, they will do so.<br /><br />No. The question is ""Why, oh why, did Steve Martin allow it to be made?"" I think he needed the money to fight a nuisance lawsuit and was determined it not cost him anything. He knew the sequel was going to be so frightful, that out of pride, he wouldn't even count it's royalties as income. <br /><br />The only way this sequel could not be an embarrassment is to have had Carl Gottlieb and Steve Martin revive the nation's favorite poor black family.<br /><br />And ""dcreasy2001"" (aka Mark Blankfield?): It's just transparently obvious that you worked on this film in some sad capacity, and the only way you can feel better about your involvement is to be the sequel's lone cheerleader as an IMDb user comment. I was praying for you to veer over into satire, but alas, you were really making an effort at spin. Why not 10 stars?"
tt0087803,"I have heard about this novel a long time ago, many of my friends have recommend me to read it. I searched it in every place and finally found it. This is a book that every man should read, because it is genius and because of it's vision. I enjoyed every page.<br /><br />I knew about the movie and could not wait to see it. When I finally did I was very disappointed, many things that are in the book are not in the movie (I do not think that this is a spoiler) that just makes the movie not logical... Michael Radford might be a good director, but a bad writer. Especially as a book adopter. The movie is not dark at all, the writing is really bad, the only thing that is good, even great, is the acting. John Hurt is an amazing actor and the only face I myself could see as Winston Smith.<br /><br />What angers me the most are the people in IMDb that called this ""The Best Adaptation Ever"" without even reading the book! Or knowing anything about screen writing!<br /><br />You can only understand the brilliance of the story by reading the book, do not consider this as an alternative. As a fan of the book, I was very disappointed.<br /><br />The points I gave for this movie goes for the acting."
tt0091631,"Nightmare Weekend is proof positive that some people are so desperate to be 'in the movies' they are prepared to do almost anything.<br /><br />I'm not referring to the countless women who seem quite happy to appear completely starkers in this dreadful piece of trash (after all, the naked female form is a beautiful thing and nothing to be ashamed of). No...I'm talking about those who are more than willing to co-star with a badly made hand-puppet called George. Now that is embarrassing!!!<br /><br />A bio-electronic being created by brilliant scientist Edward Brake (Wellington Meffert), George (who looks like a demented felt clown with green wool for hair) is the artificially intelligent interface for an advanced computer system that operates a revolutionary device (a silver sphere about the size of a golf ball) that, when ingested, can reverse character disorders.<br /><br />Edward's personality altering experiments have been successful on lab animals, but the cautious scientist is reluctant to carry out tests on human subjects, fearing that there may still be side effects. His evil assistant Julie (Debbie Laster), however, has no such qualms, and proceeds to use three beautiful young women as guinea pigs. Inevitably, they all turn into hideous killer mutants.<br /><br />With bargain basement special effects, a cast totally devoid of talent, and a plot that is almost impossible to follow (I took notes as I watched the film, and even then I am not entirely convinced that my synopsis is accurate), Nightmare Weekend is a complete and utter disaster that not even several soft-core sex scenes and a touch of gore can rescue.<br /><br />This film also features one of the most irritating characters I have ever seen in a horror movie: Tony (Bruce Morton), a Walkman wearing idiot who bops away to crap 80s music in a manner that makes me look like Justin Timberlake in comparison."
tt0092656,"Tommy JOnes and Matt Dillon do the gambling world proud. The various moves with the wrists had to be learned as throwing craps is a skill in and of itself.<br /><br />There are a few surprises. AS cynical as we are today, I fully expected the 'good girl' to be crying over his grave, instead of his Buddy's. Especially with her remarks about 'going to the funeral of her best friend', when she first meets Matt. And then of course you expect Matt to kill the guy who threw battery acid in Mr. Allen's face, blinding him (interesting role by Bruce Dern). WRRROOONNNNGGG!!! some of the other Hollywood endings DO happen, but the writing is so excellent, the acting so carefully wrought that you're blissfully unaware.<br /><br />And the music is OUT OF THIS WORLD. Taking us back to the 50s when our 'native passions' were first being unleashed by the music of Ray Charles and Bo Diddley. Even a little racism raring its ugly head in Chicago, but at a club called, wonderfully, 'Biloxi' with a Confederate flag backing up the racist remarks. I'll be watching it again, just to hear the music. Good thing I have the FACTOTUM sound track, so I can listen to that in the car. Watch both together, and you'll see how Matt has matured....playing bar room characters in both. NOw that he owns a bar in the Paramount HOtel in NYC, he probably has great opportunity to do his studies. Great actor, just coming into his own. He shows finely nuanced performances ...the good and the bad in his characters. His 'young boy off the farm' is a great study, made especially poignant because of his bassett-hound eyes. He makes love, convincingly as well. Since he was in several movies with Diane Lane as a teen-ager, I wonder how that it ...making love to an actress you kinda grew up with. Adds conviction, I'll say that."
tt0093176,"Prom Night 2 is an OK horror movie but prom night is way better and this movies about how the prom Queen Mary Lou in 1957 gets killed by her boyfriend and comes back 30 years later for revenge.The best actor in this movie is Micheal Ironside and the movie stars other OK actors and actress like Justin Louis (I),Wendy Lyon,Lisa Schrage and Richard Monette(I).And there are some good gore scenes like when Mary Lou kills the girl that is trying to hide in her locker by crushing the lockers together and how one of the students are on the computer and Mary Lou electrocutes him to death.Over all this is an OK/good horror movie and my rating is 4 out of 10."
tt0093223,House of games has a strong story where obsession and illusion play a big part. A psychologist offers to help a patient with his gambling debts and gets caught at the game.<br /><br />Have you ever felt fascination for something that was both dangerous and wrong? Watch what happens if you pursue this urge and go all the way. Sit on the edge of your chair as tricksters are being tricked and victims turn into perpetrators. You're never sure of who is exactly who in this movie.<br /><br />This is both a quality and a drawback of the script. As the movie ends you feel that the story lacks a bit of consistency. But all this is largely compensated by the excellent psychological development.<br /><br />This is definitely one of the best movies about gambling.
tt0096870,"...okay, maybe not all of it. Lured by the false promise of bikini-clad women on the movie's cover...but the HORROR...THE HORROR... ...whatever you do, do NOT watch this movie. Gouge out your eyes, repeatedly bash your skull in...do what it takes. Never again--never forget!<br /><br />"
