tconst,review
tt0976026,"R Balki tries to tell you a story that had been earlier told by Ram Gopal Verma in Nishabd in a sensuous way. This time it is mixed with mature humors.<br /><br />Amitabh Bachchan is a Chef and owns an Indian Cuisine in London. He is very dominating and arrogant and respects his job just like any other job. According to him, Cooking is an art. Still cannot make Hyderabadi Biryani properly.<br /><br />Enter Tabu who sends her the proper Hyderabadi Biryani made by her and they soon starts meeting up and finally falls in love with each other Amitabh is 65 and Tabu is 35. No probs! But one Hitch! Tabu's father Paresh Rawal!! The couples decide to meet the father for the approval of their marriage. But Amitabh realizes that Tabu's father is much younger to him. And the complications begin Performance wise all three actors are brilliant. The script of the film is very tight and interesting. The dialogues of the film are catchy. But somewhere you feel that your stomach is not properly filled. The comedy is sometimes not properly understood. The film also tries to go lengthy at some parts.<br /><br />Musically nothing much to sing about except the Title Track. The camera-work is good. Director R Balki could have given much better from this script. But in the second half he himself looks confused. The ""Satyagrah"" scene of the father looked irritating. But the lines spoken by Amitabh Bachchan during that scene are clap worthy.<br /><br />On the whole, Cheeni Kum needed to have more sugar!"
tt0019074,"""Laugh, Clown Laugh"" released in 1928, stars the legendary Lon Chaney as a circus clown named Tito. Tito has raised a foundling (a young and beautiful Loretta Young) to adulthood and names her Simonetta. Tito has raised the girl in the circus life, and she has become an accomplished ballerina. While Chaney gives his usual great performance, I could not get past the fact that Tito, now well into middle age, has the hots for the young Simonetta. Although he is not her biological father, he has raised her like a daughter. That kind of ""ick"" factor permeates throughout the film. Tito competes for Simonetta's affections with a young and handsome 'Count' Luigi (Nils Asther). Simonetta clearly falls for the young man, but feels guilt about abandoning Tito (out of loyalty, not romantic love). The whole premise of the film is ridiculous, and I find it amazing that no one in the film tells Tito what a stupid old fool he is being (until he reveals it himself at the end). The film is noteworthy only because of Loretta Young, who would go on to have a great career. While I adore Chaney's brilliance as an actor, this whole film seems off to me and just downright creepy."
tt0026725,"I had read many good things about this adaptation of my favorite novel...so invariably my expectations were crushed. But they were crushed more than should be expected. The movie would have been a decent movie if I had not read the novel beforehand, which perhaps ruined it for me.<br /><br />In any event, for some reason they changed the labor camp at Toulon to a ship full of galley slaves. The scene at Bishop Myriel's was fine. In fact, other than the galleys, things survived up until the dismissal of Fantine. Because we do not want to have bad things happen to a good woman, she does not cut her hair, sell her teeth, or become a prostitute. The worst she does is run into the mayor's office and spit on his face. Bamatabois is entirely eliminated. Because having children out of wedlock should also not be talked about, Tholomyes is Fantine's dead husband, rather than an irresponsible dandy. Valjean is able to fetch Cosette for Fantine before the Champmathieu affair, so they reunite happily, yet another change. Then comes the convent, which is a pretty difficult scene to screw up. Thankfully, it was saved. After this three minutes of accuracy, however, the movie again begins to hurtle towards Classic Novel Butchering.<br /><br />As Cosette and Valjean are riding through the park, they come across Marius giving a speech at a meeting. About prison reform. When he comes to hand out fliers to Valjean and Cosette, he says the one line in the movie that set me screaming at the TV set. ""We aren't revolutionaries."" I could hear Victor Hugo thrashing in his grave. OF COURSE THEY ARE REVOLUTIONARIES! They want to revolt against the pseudo-monarchy that is in place in favor of another republic, you dumb screenwriters! It's a historical FACT that there was an insurrection against the government in 1832. <br /><br />At one point Cosette goes to give Marius a donation from her father for the reform movement and meets Eponine. Except...not Eponine. Or at least not the Eponine of the book. This Eponine appears to be a well-to-do secretary girl working for the prison reformers (who are working out of the Cafe Universal as opposed to the Cafe Musain). Not to mention the audience is already made to dislike her thanks to her not-period, low-cut, tight-fitting dress and her snooty mannerisms.<br /><br />The prison reformers (Lead by the most poorly cast Enjolras that I have EVER seen) decide that handing out pamphlets isn't good enough anymore. So they're going to build barricades. I don't know about you, but I have never heard of reform movements tearing up the streets and building barricades and attacking government troops. About three hundred people (it was not supposed to be so many) start attacking the National Guard and building a bunch of barricades, etc. Eponine does die for Marius, thankfully. <br /><br />The rest of the movie is sort of accurate, except that Javert's suicide again seems hard to understand thanks to his minuscule screen time and odd character interpretation. The movie ends with Valjean watching Javert jump into the river. This is again inaccurate because Valjean would never have let Javert drown. He saved the man's life earlier, why let him die now? Then there's the whole skipping of Valjean's confession to Marius, his deterioration, and his redemption on his deathbed with Marius and Cosette by his side.<br /><br />Overall, I can blame the script mostly for the problems. While I am glad Enjolras and Eponine were at least present in the film, they were terribly misinterpreted, as was the entire barricade scene. The elimination of Fantine's suffering prevents us from feeling too much pity for her. That Cosette knows Valjean's past from the start messes with the plot a good deal. I did not even see Thenardier, and Mme. Thenardier only had a few seconds of screen time. The same with Gavroche. I did like Frederich March's interpretation of Valjean a lot, however, which was one of the redeeming features of the movie. On the other hand, Charles Laughton, for all his great acting in other movies, seems to have missed the mark with Javert. The lip tremble, the unnecessary shouting, and his acting in general all just felt very wrong. He also, like many Javerts I have seen, did not appear at all menacing, something required of the character.<br /><br />Again, this film would probably feel much better if I had not read the book. I would not recommend it to book purists, though. I would also say that the movie would have been a good adaptation for the time had not the infamously accurate French version come out the year before."
tt0028944,"Luise Rainer received an Oscar for her performance in The Good Earth. Unfortunately, her role required no. She did not say much and looked pale throughout the film. Luise's character was a slave then given away to marriage to Paul Muni's character (he did a fantastic job for his performance). Set in ancient Asia, both actors were not Asian, but were very convincing in their roles. I hope that Paul Muni received an Oscar for his performance, because that is what Luise must have gotten her Oscar for. She must have been a breakthrough actress, one of the first to method act. This seems like something that Hollywood does often. Al Pacino has played an Italian and Cuban. I felt Luise's performance to be lackluster throughout, and when she died, she did not change in expression from any previous scenes. She stayed the same throughout the film; she only changed her expression or emotion maybe twice. If her brilliant acting was so subtle, I suppose I did not see it."
tt0032155,"I tried twice to get through this film, succeeding the first time - and it was like pulling teeth - and failing the second time despite a great DVD transfer. The problem? It's simply too boring.<br /><br />If you can get to the dramatic courtroom scene, which takes up most of the second half of the film, you have it made, but it's tough getting to that point. There are some interesting talks by ""Abraham Lincoln"" (Henry Fonda) during the trial. The ending is touching as Lincoln walks off and they superimpose his Memoral statue over the screen.<br /><br />It's a nice story, well-acted and such....but it lacks spark in the first half and discourages the viewer from hanging in there. I suspect the real Abe Lincoln was a lot more interesting than this film."
tt0033771,"Roy Rogers stars as Jesse James and his look-alike, gambler man Clint Burns. George ""Gabby"" Hayes is Mr. Rogers's ex-pal, Sheriff Gabby. Gale Storm (Jane Fillmore) and Sally Payne (Polly Morgan) are a noteworthy team, as two reporters on the lookout for stories about the elusive outlaw hero.<br /><br />Of course, mistaken identity / impersonation is a plot development, since Rogers essays a ""dual role"". Rogers is charming, as usual; but, there is nothing really elevating this his performance above the ordinary - any potential to deliver a memorable Jekyll/Hyde performance is done in by poor material. The better pair to watch are Ms. Storm and Ms. Paye as the St. Louis Journal reporters - they are the film's highlight. The songs are fine, though badly synched. <br /><br />*** Jesse James at Bay (1941) Joseph Kane ~ Roy Rogers, George 'Gabby' Hayes, Gale Storm"
tt0035096,"This is a direct sequel to 'The Mummy's Hand' (1940), because the lead character, Stephen Banning (played by Dick Foran) is now thirty years older and is relating the story (with the help of archival footage) to his son's fiancé. There are only two unusual aspects to the film: the early death of Banning, and the presence of Turhan Bey.<br /><br />Lon Chaney as the mummy Kharis gets top billing, though given the nature of his role, he has little more to do than limp along or thrash his arms about. There's nothing scary about his presence, except for his attempt to carry off the fiancé, Isobel (Elyse Knox). Dick Foran gets second billing, but he's killed off within the first fifteen minutes! We'd have to wait until 'Psycho' (1960) when a lead character (Janet Leigh) dies way before the end of the movie! Banning's buddy from the first film, Babe Jenson (now Henson), shows up a little later looking much, much, older and not doing any of the comic shtick he did in the original. It's hard to believe it's the same actor! Unfortunately, this great acting job is wasted because he gets killed by Kharis after only two brief scenes. It's then left up to Banning's son John (played by bit player John Hubbard) to led the chase to the cemetery--NO! The sheriff leads a torch wielding mob to Banning's house to burn it down and kill the mummy. Sound Universally familiar? <br /><br />Turhan Bey is introduced to audiences as the new High Priest, Mehmet Bey, to care for and feed tana leaves to Kharis. With his 'exotic' voice and appearance, it's too bad he gets so easily killed. A better movie would have had 'Babe' take Von Helsing type charge of things in tracking down the mummy, with a final decisive battle with him and Mehmet Bay. But instead we have a pedestrian rehash of different set pieces from previous Universal horror films, put together by the hack Griffin Jay who wrote many of Universal's other clunkers, although he also did 'Don Winslow of the Navy' (1942) as well as 'Don Winslow of the Coast Guard' (1943) which also featured Elyse Knox.<br /><br />Elyse Knox played Anne Howe in six Joe Palooka movies (1946-1949), and of course, Turhan Bey, with 43 movie and TV credits, is great in the title role of 'The Amazing Dr. X' (1948).<br /><br />The cinematography is much darker and more atmospheric (with lots of noirish shadows in the sheriff's office) than the first 'Kharis' mummy film, but there's little else of interest or excitement.<br /><br />I'll give it a 3."
tt0037382,"Or ""Marlowe At Sea"". Yet another ridiculously overrated old film with Bogey. Quite talky, too. Bogey basically plays the same character as in the Marlow films; always in control of a situation, never nervous - no matter how dangerous a situation, calls women ""slim"" and ""dames"" and other such nonsense, is the only ""real male"" i.e. alpha male in the movie (the only other alpha male male being the head of Gestapo - but he is only a fat alpha male male), and - naturally - every attractive young woman who comes his way cannot resist his charms and wants his penis within hours of their initial introduction. The character clichés are all here. Bogey is supposed to be the same type of cynic-about-to-reform as in ""Casablanca"", and naturally he often refuses money or other valuables when being offered them - but how does that fit in with the tough cynic in him? It doesn't, so he can't be a cynic; Hawks wanted it both ways: a character who is both the ""cool lone cynic"" and yet a well-meaning humanitarian. I don't think so... Bacall does her non-chalant ""cool babe"" routine for the first time, and there are plenty of overrated, not all-too interesting so-called ""sexual innuendo"" exchanges between her and Bogey; these dialogues sound silly by today's standards. ""Just purse your lips and whistle..."". A load of crap... She was 19 when this was made but looks a lot older, and is far less attractive than the female stars of the day. Her bony face, with its sharp features, is nowhere even close to radiating the kind of feminine beauty of a de Havilland, the cuteness of a Myrna Loy, let alone the likability of an Irene Dunne. Bacall was more suited for playing vampires, not femme-fatales. (In real life she is very much like her face: a Hollywood bitch.) There is a scene in which Bacall breaks into tears; very unsuitable for her character. There are two or three bad musical numbers - but my fast-forward button was ready.<br /><br />If you're interested in reading my ""biographies"" of Bogart, Bacall, Huston, and other Hollywood personalities, contact me by e-mail."
tt0039111,I don't know if the problem I had with this movie is that I was not able to capture the way movies were done in the past but I believe that this one did not miss to make use of any of the the fashionable conventions available in the 40s to make a film. If you don't have anything better to do my advise is not to watch this movie but to read a book or to go out for a walk.
tt0046149,"I sat through this movie this evening, forcing myself to stick with it even though I never cared about any of the characters or what happened to them, because the two leads, Gérard Philippe and Michèle Morgan, were major film stars of their era and I wanted to see them in ""something different,"" which this certainly was. They both gave fine performances, but of distasteful characters.<br /><br />Indeed, the whole movie is about a shabby little town in Mexico inhabited by almost uniformly distasteful characters (the doctor is, of course, the major exception). What Michèle Morgan ever sees in Philippe to fall in love with him is never explained.<br /><br />This is supposedly based on a work by Jean-Paul Sartre. All I could think was that, if Sartre's work is anything like this movie, it must be a very mediocre attempt at imitating Camus' masterful novel The Plague, which dealt with a plague in North Africa.<br /><br />A well-acted but uninteresting movie."
tt0065400,"I absolutely hate it when a film completely falls apart near the end, after you've already invested an hour into it. and that's what happened with this film. i was intrigued by its actors and the fact that malamud wrote its source story. I haven't gone to read that story but I cannot imagine that it ends like this film ends.Fortunately i didn't pay good money to see or rent it because my library had it. ohhhh such a waste of excellent acting (the wife in particular was so perfect).but milo o'shea as a Jew?!!!! now THAT was funny. I haven't researched into its making but it played like the director lost his marbles or died 3/4 of the way through the film. Before that point, a story and characters were developing,there were a number of neat plot points and there wasn't too much time wasted. but ooh that last 1/2 hour- if that wasn't the screwiest, most worthless denouement I've ever witnessed, I don't know what is. I just hate it when one's faith is so destroyed like that; it feels like an act of violence."
tt0065750,"This is one very confusing movie. The film is very hard to follow and the plot just didn't seem to make any sense. The Fury of the Wolfman was made in Spain and I think that when any film is dubbed from one language to another, it doesn't translate exactly as it was first meant. Maybe this is part of the problem but I doubt if it can account for all the problems with this film. The dubbing is pretty bad and the voices don't match the characters very well. The scenes are choppy, there is an array of strange and irrelevant characters that do little more than confuse the viewer even more. What I did like about this film was the look of the wolfman himself and the scenes where he attacks. Now if they could have put it all together and had it make some sense, they might have had something. Don't waste your time on this one."
tt0065905,"(aka: BLOOD CASTLE or SCREAM OF THE DEMON)<br /><br />*spoiler*<br /><br />This was a drive-in feature, co-billed with THE VELVET VAMPIRE. A Spanish-Italian co-production where a series of women in a village are being murdered around the same time a local count named Yanos Dalmar is seen on horseback, riding off with his 'man-eating' dog behind him.<br /><br />The townsfolk already suspect he is the one behind it all and want his castle burned down. The murders first began around the time Count Yanos' older brother, Count Igor Dalmar was horribly burned and killed in a lab accident.<br /><br />Then a woman Ivanna (Erna Schuer) that Igor hired before his death to assist him in his experiments shows up. Yanos agrees to hire her in place of his brother and together they seek the formulae for the regeneration of dead cells. Yanos wants to bring Igor's charred corpse back to life.<br /><br />But of course Igor is still alive (although horribly burned) and stalking and killing the women in the village. We see his char-broiled face appear at various points in the film, so we know he's still alive, making the whole thing seem a little bit too obvious.<br /><br />Igor meets another fiery end when he gets into a fight with Yanos over Ivanna, with the burning candles falling on to the same bed that Igor stumbles on to, meeting yet another, final char-broiled end.<br /><br />The Retromedia DVD is taken from a VHS source and looks quite grainy and bad. Other than an even scratchier trailer, no other extras are included. Although it has a nice, creepy Spanish castle and good atmospherics, I found it to be fairly boring and predictable, with no excitement or mystery, whatsoever. <br /><br />3 out of 10."
tt0068154,I have seen this movie and the other one. Trinity is my name and i find that this one is worse then the first one. I have no idea why they even made another movie it was stupid and pointless sorry to say that i have all of them. I have sat through them number of times and it still drives me to turn it off 5 minutes into the movie. I like Terence Hill movies and i like Bud Spencer but this movie just drove me up the wall. If it had a different story line or at least more of a plot and more comedy it might have been funner and worth the 5 dollars i spent buying all the movies. But you make mistakes so i would say save your money and don't bye this movie or any of the ones that go with it trust me on this one.
tt0068339,"I have to be completely honest in saying first that I fell asleep somewhere in the middle, so I cannot give a full opinion about the film until I see it in full. Basically, a group of thieves, including Sid Carter (Sid James) and Ernie Bragg (Bernard Bresslaw), plan to make a fortune stealing a shipment of contraceptive pills from Finisham maternity hospital. This is where title character Matron (Hattie Jacques) works, along with staff members Sir Bernard Cutting (Kenneth Williams), Dr. Francis Goode (Charles Hawtrey), Dr. Prodd (Terry Scott) and Nurse Susan Ball (Barbara Windsor). Patients and their visitors are around too, including pregnant Mrs. Tidey (Joan Sims) and her nervous dad-to-be husband Mr. Tidey (Kenneth Connor). Also starring Bill Maynard as Freddy and EastEnders' Wendy Richard as Miss Willing. This plan by the way is not working out by the way, because all the staff are getting in the way. That's pretty much all can say about the film until I see it again in full. Okay!"
