tconst,review
tt0117382,"Three part ""horror"" film with some guy in a boarded up house imploring the viewer not to go ""out there"" and (unfortunately) gives us three tales to prove why.<br /><br />The first story involves a young couple in a car accident who meet up with two psychos. It leads up to two totally predictable twists. Still, it's quick (about 15 minutes), violent, well-acted and well-done. Predictable but enjoyable.<br /><br />The second involves a man on the run after stealing a large amount of money. His car breaks down, he's attacked by a dog and stumbles into a nearby clinic. VERY obvious, badly done and extremely slow. Even at 30 minutes this is too long. Good acting though.<br /><br />The third is just barely a horror story. It involves a beautiful, lonely woman looking for Mr. Right. It has beautiful set designs, a nice erotic feel and a nice sex scene. But (again) predictable and not even remotely scary.<br /><br />It ends very stupidly.<br /><br />All in all, the first one is worth watching, but that's it. Tune in for that one then turn it off."
tt0146315,"I notice that the previous reviewer (who appears to be still at school) gave this movie a very good review and I can only assume that this is because the reviewer hasn't seen the far superior 1989 BBC adaptation of this classic novel. The major problem I had with this (1999) version was the casting of Anthony Way as Tom Long. Anthony Way was a talented boy treble who shot to fame after appearing in the TV mini-series ""The Choir"". I can only assume that he was cast for the role of Tom Long on the strength of his excellent acting in ""The Choir"". Unfortunately the small boy who appeared in ""The Choir"" had grown into a tall and gangly youth by the time ""Tom's Midnight Garden"" was filmed and as such Anthony fails to convince as schoolboy Tom. It is too far a stretch of the imagination to believe that Tom (as played by Anthony) would befriend the far younger Hatty. In the 1989 BBC version Tom and Hatty are much closer in age and the development of their friendship is so much more believable. For a 1999 movie even the special effects fail to convince and are not any noticeable improvement on the 1989 TV effects. The casting and acting of this version are inferior to the earlier adaptation and all in all the movie was a lack lustre version of a true classic. As a final observation I would point out that the VHS of the 1989 BBC version fetches well over £20.00 second hand whereas a new DVD of this version can be bought for under £5.00, need I say more?"
tt0165494,"Was this movie stupid? Yup. Did this movie depth? Nope. Character development? Nope. Plot twists? Nope. This was simply a movie about a highly-fictionalized Springer show. It shows the lengths that some people will go to get their mugs on TV. Molly Hagan did a great job as Jaime Pressly's mom. Jaime is....well...GORGEOUS! This flick wasn't so much made to be a ""breakthrough"" movie, rather, it was intended to life in a trailer park (I live in a trailer park and ours is nothing like the one in this movie) where everyone sleeps with everyone else, all the girls get pregnant by different guys, and all the guys drive rusted-out '66 Ford pickups (exaggeration, of course, but that's the picture everyone sees when you mention ""trailer park""). Some people over-analyze movies (case-in-point: Star Trek freaks). I watch movies purely for the entertainment value; not to point out that the girl is wearing a different shirt in a different scene (read the ""Goofs"" bit about Connie's shirt. Could it have been better? Sure. But it was funny as hell."
tt0176700,"On a distant planet a psychopath is saved from execution by a space monk. He releases a few fellow inmates and breaks out of the prison in a spaceship. They dock onto a ludicrously enormous spacecraft that is orbiting a supernova star. This massive craft is populated by only three people, presumably because the budget of the film did not extend to hiring many actors. Anyway, to cut a long story short, the three goodies end up in a game of cat and mouse with the baddies.<br /><br />The psychopath in this movie is curious in that he is annoying. 'Annoying' is generally not a term one would use to describe a lunatic - unhinged, frightening, dangerous maybe but not 'annoying' but he is. The three people manning the giant ship are seriously unconvincing as warranting such important roles - this ship is practically the size of a city! Considering that the film is set approximately 50 years in the future, it is somewhat optimistic that such a huge man-made craft could exist, never mind the fact that it is used for such a relatively mundane task. Despite the vast size of the spaceship, the crew all have appallingly kitted out, tiny rooms and the dining room consists of what appears to be a plastic table and chairs. But there are a lot of corridors.<br /><br />The film is fairly well acted and it works as an averagey sci-fi thriller. But nothing great."
tt0189456,"Rip off of ""Scream"" or especially ""I know what you did last summer"", there's some entertainment here, and a little scary, but they needed some originality.<br /><br />An entertainment score? 6.5/10 Overall? 5.5/10"
tt0195234,"...but I regret having seen it. Since the ratings on IMDb are relatively high (and they must also have been relatively high on Netflix), I guess I put it in my queue because it is advertised as a gentle comedy from the UK, a category that has produced many films I liked immensely. ""Saving Grace,"" on the other hand, falls into the category of laugh-less comedies usually populated by Hollywood movies produced and directed by the talentless. Brenda Blethyn is a capable actress, and I have liked her in other movies. The concept -- a gardener growing marijuana to overcome the penury she finds herself confronting after her husband's death -- does not offend me. Notwithstanding the strenuous efforts on the part of the cast to produce humor, the film falls flat on its face (falling flat on its arse might have been funnier) as far as I and my wife were concerned. Be forewarned, oh gentle reader, not all offbeat British comedies succeed. This one is a dud."
tt0211938,"...that Jamie Foxx would ever deliver such a wonderful, Oscar-winning performance. One of the reasons why I was so impressed with Foxx's performance in ""Ray"" was because from watching his hammy, obnoxious acting in movies like ""Bait"" and ""Booty Call,"" I would never imagine he would ever hold the Oscar. If people told me five years ago that Jamie Foxx was one day going to win an Oscar, I would laugh right in their faces. Who knows? Maybe he's better off sticking to drama, because if you watch ""Bait,"" it's clearly evident that comedy is not his forte. I swear, Jamie mugs so much in this movie that I'm surprised his face didn't fall off. And why does he have to do those stupid voices at every chance he gets? Anyone familiar with comedians like Bob Newhart and Steven Wright knows that doing comedy doesn't require being loud and obnoxious. If a joke is funny, it's funny. If it's not funny, then doing some crazy accent is not going to make it any funnier. The problem I have with some comedians who decide to try acting is that they favor getting laughs over being in character. In real life, normal people don't always have witty comebacks and quips. Like Albert Brooks said in an interview discussing his character in ""Taxi Driver,"" it's important to be funny as your character, rather than be funny as a comedian. A prime example of Jamie violating that rule is the nauseatingly awful scene where his mug shots are being taken, and he starts posing for the photographs like a model. If a regular person were being thrown in jail, would he really be acting goofy while having his mug shots taken? And wouldn't the police try to scold him if he was? There are many scenes like that throughout the film. Another awful sequence is one where Jamie is on the unwittingly on the phone with the villain, and he starts doing a phony Caribbean accent. Not funny! Not to mention Jamie never seems to acknowledge the timing of a joke. Giving a comedic performance requires patience, whereas he goes straight to the punchline, whether it's the right time for it or not. I'm not even a big Mike Epps fan, but even his performance is good in comparison to Jamie's. As a matter of fact, this is the first time I felt somewhat relieved whenever he would appear on screen. Epps has the same flaws when it comes to comedy, but at least he chooses a more low-key approach. One of the few bright spots in this clunker of a comedy is David Morse, a highly underrated actor mostly known for his supporting roles as villains. He seems to be the only actor in the film concerned with grounding it in reality. However, fellow ""Green Mile"" star Doug Hutchison is disgustingly over-the-top as the villain. A big surprise, considering he gave a superb performance in ""The Green Mile,"" also playing a heavy. Antoine Fuqua has proved his directing chops in movies like ""The Replacement Killers"" and ""Training Day."" Even in ""Bait,"" he shows he can direct a hell of an action sequence. His only problem seemed to be in disciplining Jamie Foxx, who probably improvised half the script with one bad joke after another. Unless you're a die-hard fan of Foxx, please don't take the bait."
tt0231775,"Chris Rock deserves better than he gives himself in ""Down To Earth."" As directed by brothers Chris & Paul Weitz of ""American Pie"" fame, this uninspired remake of Warren Beatty's 1978 fantasy ""Heaven Can Wait,"" itself a rehash of 1941's ""Here Comes Mr. Jordan,"" lacks the abrasively profane humor that won Chris Rock an Emmy for his first HBO special. Predictably, he spouts swear words from A to Z, but he consciously avoids the F-word. Anybody who saw this gifted African-American comic in ""Lethal Weapon 4,"" ""Dogma,"" or ""Nurse Betty"" knows he can elicit more laughter with the F-word than Martin Lawrence and Eddie Murphy put together. Sadly, despite a few witty one-liners, ""Down To Earth"" hits Rock bottom both as a contrived comedy and an improbable interracial romance.<br /><br />""Down to Earth"" utterly destroys any good will that the Weitz Brothers generated with their landmark gross-out face ""American Pie."" This disposable drivel qualifies as a contrived as well as confusing comedy with a thoroughly improbable color-blind interracial romance. Unfortunately, a more than competent castamong them ""The Full Monty's"" Mark Addy, Chazz Palminteri of ""Analyze This,"" ""SCTV's"" Eugene Levy, and newcomer Brian Rhodes as Charles Wellington, Jr.are wasted in flat-footed, sketchy roles. Hardcore Rock fans will undoubtedly accuse their favorite comedian with trying to fix something that was never broken. Abysmally written by Lance Crouther, Ali Le Roi, Louis CK, and Rock, ""Down To Earth"" casts Chris as a messenger who rides a bike by day in the Big Apple and gets booed off the stage at night in Harlem's celebrated Apollo Theatre. Poor Lance Barton (Chris Rock) suffers from severe stage fright. Nevertheless, his charitable manager Whitney Daniels (Frankie Faison of ""Hannibal"") sticks with him through thick and thin. After Lance learns the Apollo Theatre will hold one final amateur night extravaganza, he implores Whitney to get him in the line-up. Excuse me, but if Lance is such a deadbeat stand-up comic, why does the Apollo keep inviting him back? Meanwhile, fate has something else in store for Lance. While pedaling home on his bike, our protagonist spots a pretty lady, Sontee (Regina King of ""Jerry Maguire""), crossing the street, but he doesn't see the bus that collides with him and kills him. Wham! Lance Barton levitates skyward with a halo wreathed around his head. In Heaven, which resembles a cruise ship nightclub, Lance learns that an overzealous angel, Mr. Keyes (Eugene Levy of ""Stay Tuned""), timed his death 40 years ahead of schedule.<br /><br />Heavenly honcho Mr. King (Chazz Palminteri of ""Analyze This""), God's right-hand guy, apologizes and escorts Lance back to earth. The snag is Lance cannot reclaim his corpse, so he must inhabit another body. The best that Mr. Keyes can come up with is ruthless, white, 60-year old tycoon Charles Wellington. Wellington's adulterous wife Amber (Jennifer Coolidge of ""American Pie"") and his unscrupulous personal aide Winston (Greg Germann of ""Sweet November"") have just tried to poison him. Reluctantly, before Wellington's body vanishes, Lance accepts it conditionally as a loaner until Keyes can locate a more appropriate body. Meanwhile, Lance-as-Wellington encounters Sontee again. She is a nurse activist protesting his decision to privatize a Brooklyn community hospital that serves the poor. While Regina King brings a surfeit of charisma to her role as a crusading health care worker, she plays a character who bypasses credible motivation in her affairs with Wellington. Although he is no longer black, Lance not only tries to woo Sontee but also win a gig at the Apollo.<br /><br />""Down To Earth"" features Rock in his most unfunny role. The comedian's reason for making this movie seems questionable. Reportedly, he ate lunch with Warren Beatty and told Beatty that he loved the original script that scenarist Elaine May had penned for Beatty. Initially, Beatty tried the race-reversal gimmick himself in his own version by trying to cast Muhammad Ali in the title role of ""Heaven Can Wait."" The deal fell through, and Beatty headlined the movie himself. According to Rock, his longtime co-writers and he thought that they could 'annihilate' this classic. Moreover, he justified his choice of ""Heaven Can Wait"" based on his philosophy to ""Do Something you can only do when you're hot."" Earlier, Rock rejected a script about a busload of touring rappers, because he saw little opportunity to stretch his image in such an outing. As a lifeless comedian in ""Down to Earth,"" Rock doesn't so much stretch his image as he inverts it for the worst! This half-baked concert film with an annoying plot does as much to cremate his comic reputation as it does the Weitz Brothers! You know a film about a comedian is in dire straits when a scene at the nightclub is played so you cannot hear the jokes, only the laughter. Similarly, the casting of Mark Addy as Wellington's butler who speaks the Queen's English but is in reality a commoner from Michigan defies logic, too. Addy is an actual Englishman, and he doesn't have to fake an accent; his accent is genuine. The major overriding quandary with ""Down to Earth"" is the on-again-off-again, look-a-like switcheroo that the characters make so Chris Rock doesn't disappear completely from the sight for more than a few seconds. Although Chris spends half the movie as white guy Wellington, audiences see him largely as Lance, undercutting the comic irony of watching his stocky, bald-headed, Caucasian white, alter-ego perform ghetto humor and chant derogatory hip-hop lyrics. Incredibly, Rock served double-duty as the film's executive producer and one of its four scribes. The mystery is how such a wealth of talent could grind out such an awkward, misguided muddle of a comedy. About the only redeeming feature of ""Down to Earth"" is Jamshied Sharifi's superb orchestral film score."
tt0274321,"This has to be one of the 5 worst movies ever made. The plot looked intriguing like that of Passenger 57. But with the latter movie it somehow worked a lot better. The plot has been worked out in the worst possible way. Just a few of the awful moments in the movie, A flight attendant is standing in the opened doorway of a flying 747 and trying to close the door without being sucked out by the 250 mile per hour winds?!? Thereafter the lands the aircraft from a few miles out starting at 8000 feet, thats impossible even for 747 pilots with thousands of hour experience. When on the runway (perfectly straight of course) she is instructed to pull on the flaps, HUH!! Come on flaps are there to ensure lift at low speeds, when on the runway you use thrust reverse on the engines and give maximum power! I can go on and on about little and mostly big mistakes in the movie, but then my reply would become the size of the English dictionary. This is a movie you want to miss, take my word for it!"
tt0285351,"I love the episode where Jim becomes the Greenman. It is great! When Jim tosses that little person through the window, the look on his face is priceless. Then when he starts to address the Priest in his wife's behalf only to find out that she has become the Pee-Woman? Great writing and great casting along with great acting makes this a must see. I am attempting to find a certain photo from that episode. I'd like to use it as my avatar on a message board because I think the Greenman is hilarious. Does anyone know where I can download a photo of Jim as the Greenman? Can anyone point me in the right direction to find such a photo?"
tt0293563,"I'm afraid this one is pretty dreadful, despite several good performances and generally competent acting-for-the-camera direction. It's a first and last attempt by writer-director Soo Lyu. ""Rub and Tug"" (2002) is one of the unfortunate by-products of Canada's program to promote home-grown film-making. While the program encourages worthwhile efforts like ""New Waterford Girl"" it opens the door for untalented novices like Lyu who did not have to aggressively pitch this project but was green-lighted without an adequate examination of her script or her credentials. <br /><br />You don't mind the low budget because the shabby production design, bad lighting, poor audio, and dreary docu-style shot selection is consistent with the subject matter; the workers in Canadian massage parlors. But the dialogue and the plotting doesn't give the actors anything to work with, the editor much to assemble, or a viewer any mental challenge other than suspension of disbelief. When your story is this simplistic the last thing you need is a muddled storytelling technique; even though nothing happens, the movie is hard to follow and point-of-view impossible to pin down. <br /><br />Don McKellar's performance as Conrad is several notches below his similar characterization in ""Exotica"". Lindy Booth's Lea is her standard quirky airhead; as always she is likable but here she is little else. Kira Clavell's Cindy is a pleasant surprise, a kind of Asian Shelley Duval. The only other role of any consequence, Tara Spencer-Nairn's street-wise Betty, more than cancels out her excellent performance in ""New Waterford Girl"". Her shallow performance in ""Rub and Tug"" should curtail any tendency to seek out other films in which she has appeared; unless you need further confirmation of ""Waterford"" director Alan Moyle's skill in working with young actors. <br /><br />You quickly conclude that Lyu's reptilian brain cannot grasp concepts like plot complexity, so the need to insert a lazy and lame ""deus ex machina"" device toward the end is hardly a surprise. Still it could be worse, the listless story has so little internal logic anyway that the unlikely ending is not as painful as would normally be the case. <br /><br />Then again, what do I know? I'm only a child."
tt0303816,"There's a major difference between releasing an original, intense, edge-of-your-seat, scary, gore-fest, and doing like filmmaker Eli Roth and his team have done with ""Cabin Fever"" and simply acted like it. The film follows five college graduates into a cabin in the woods that begins to prove fatal as one after the other succumbs to this mysterious, fast-acting, flesh-eating disease. It's not long before the friends turn on one another, and can barely stand the sight of one another, much less want to be in the same vicinity as them. As gross as it all sounds, there's a certain spark behind the basic premise of this film that could have worked, in the hands of a less cocky filmmaker. Unfortunately what we end up with is poorly drawn characters whose sole purpose seems to be to look beautiful at the beginning to make the inevitable decomposition more contrasting, a hackneyed script so profanity-laden as to leave the viewer tuning out the dialogue, and several incomprehensible subplots that motivate little more than (in one instance) an on-screen appearance by director Roth. This is sloppy film-making in several ways! Avoid this time devourer."
tt0304377,"I borrowed this movie because not only because its gay theme but the thought of role playing really intrigued me. I was pleasantly surprised that it was shot in San Francisco since I live near SF. And of course it was nice to see shots of the Castro district (although the castro to me really caters more to gay male than female). But other than that I can't really recommend this movie. The characters aren't really developed for me to care and when they finally started to get to the ""role playing"" I was already bored out of my mind. And the role playing scenes that I did see were a bit embarrassing to watch. The acting leaves something to be desired. Needless to say I didn't finish the movie. I'd skip this one."
tt0311018,"This movie was lame, lame, lame. What a build up! What a let down. All form, no substance. A terrible waste of talent and time. Would not recommend it to my husband's dog, who will watch anything."
tt0424095,"Don't understand how these animated movies keep coming out, and no matter how good (or bad) it is people love it.<br /><br />I saw this movie with my two kids (5,7). They like pretty much anything animated (like most people who rated this film). The theater was almost full, and I looked forward to seeing the movie with its superb cast. To tell the truth I was bored silly. It was unbelievably predictable and just plain unfunny. There were a couple chuckles throughout the film and that was it. Of course they tried time and time again to get the cheap laugh, but just didn't work. My son almost always says to me that he wants the DVD after we see an animated movie, but not on this one. My daughter fell asleep half way through. Also, the kids thought the character animation looked weird. I haven't heard that from them since seeing The Polar Express, which gave my daughter nightmares.<br /><br />Trust me, I'm not the type who looks for the negative in everything. But quality is quality, and like so many animated movies they throw out there, it has very little."
