tconst,review
tt0382765,"With no fault to the actors (they all put on great performances), the overall story was not very well executed. The movie opens with a great zinger: a crazy old guy forces a young Aborigine girl's car off the road. But then, we're forced to endure 40 minutes of character development with an entirely new group of characters ... and we don't know why until the 40 minutes are up. It turns out that they are the ones who eventually discover the girl's body ... and the story progresses from there.<br /><br />While the story does pick up at that point, it really goes nowhere. After 2 hours, I asked myself: was there a point to this, or was it just to see the characters struggle with accusations of racism and stupidity of how they handled the discovery? The story was ultimately unsatisfying and felt unfinished. While it is well acted, there's not a strong enough backbone in the film to warrant recommending it."
tt0388769,"What's with Indonesian musical movies? Never have I seen Indonesian musical movies like the ones made in Bollywood. They miss the spirit of the story and just a bunch of 'what they called' poetic lines.<br /><br />This story about love of two kids who are separated and then meet again after a few years of changes has no special remarks. It's a simple story plot (but it's quite focused though) with 'meant to be' musical story lines here and there.<br /><br />Confusing characters that should be saved by brilliant acting are neglected. The main actress may try to live up the character, but it's the best that she could do, trying. As for the casting, I don't feel the necessity to put a Balinese student in that story and of course, that's not the only unnecessary characters.<br /><br />The strange thing is, why would I want to watch this movie? Maybe because of the mangoes..."
tt0402711,"We purchased this series on DVD because of all of the glowing reviews we had seen here. I gave it three stars because there can be little doubt that sometimes the acting, directing and writing are brilliant. In fact they are so brilliant we did not see the propaganda that was being transmitted so smoothly on the series. If one watches it with discernment, one will see the entire litany of the radical right wing beliefs being promulgated by the Fox (Faux) News Network. To avoid giving away any spoilers I will refrain from pointing out all of the dozens of specific instances. A brief look at the plots found here on IMDb will disclose that everything from torture to gun control to the right of a network to provide ""Infomercials"" and call them news is justified with cute plot twists and impassioned speeches given by some of the best actors in the world. We watched many shows and finally gave up in disgust when they justified torture using Attorney General Gonzales as a shining example of why all kinds of torture should be used in the name of protecting all of us. The series also manages to demean male and female gays in subtle ways by using them as plot devices depicting evil people. All in all the complete litany of the radical religious right wing.<br /><br />No doubt the popularity of this program will be used by future historians as proof that America lost its way in the early part of the this century. As a student of history myself I would characterize this program as being in a league with the propaganda produced by Goebbels for Hitler and some of the propaganda produced by Hollywood for the American audience during WWII.<br /><br />So if you want to use this as a teaching tool to help your students understand how subtle propaganda can be then by all means do so. Just be sure to purchase an inexpensive used copy so you can avoid enriching the ultra right wingers at Faux Network who produced this travesty."
tt0428608,"Anna lives with her family in a new housing estate just outside the city. She has been with her husband Sebastiaan for years and they don't talk so much anymore. While on a working visit abroad, a female colleague commits suicide. Anna is deeply impressed by her death, even though she hardly knew her. Nobody seems to know why she took her own life. For the first time Anna realizes that one can be an unknown among your most dearest. Anna doesn't mention the incident back home and starts observing her husband and child. Guernsey is the story of a woman who suddenly starts looking at her own life. And she wonders how she got so drifted apart from the people closest to her.<br /><br />(This is my translation of the DVD cover text synopsis. I hope you find it useful, as this movie doesn't have an IMDb Plot Summary yet at this date.)"
tt0438850,"Watching Floored by Love one thought comes almost immediately to mind, ""My god this looks like a really bad sitcom."" Sure enough, it turns out that FBL is a pilot for a series that may start this fall in Canada, poor poor Canada.<br /><br />Cara (Shirley Ng) and Janet (Natalie Sky) are a lesbian couple living in Vancouver. Janet has come out to her mother already but Cara's parents are still in the dark about their daughter's homosexuality. The pressure is on to out herself though when the parents come from Malaysia for her younger brother's wedding. That same week British Columbia legalizes gay marriage. With Janet wanting to wed, Cara has to decide whether or not to tell her conservative Chinese parents that's she's gay. Will she? Would she? Could she? Cara's situation is contrasted with that of Jesse (Trent Millar). Jesse has just declared his homosexuality to the world at the age of fourteen. His biological father Daniel (Andrew McIlroy) is coming for a visit soon. His stepfather Norman (Michael Robinson) fears that his chances of finally being fully accepted by Jesse are harmed by the fact that Daniel is gay and he is not. Will dialing 1-800-Makeover help?<br /><br />The dialogue and delivery come straight out of a lesser 1950's program along with the overdone physical emoting. The Full House-style melodrama is enough to make you wince from time to time and the attempts at comedy largely fail. McIlroy, Millar & Sky are the only performers that approach competency in this miscalculation but given the material they have to work with, it's no surprise that none impress. It's possible that the campiness was purposeful. It often seems like there is no way the performers are really that bad, that they must be trying to mimic the inferior sitcoms of days yore. If this is indeed the case than this review should probably be rewritten. The rewrite would focus on Floored by Love being a poor and ineffective send-up of old sitcoms.<br /><br />Writer/director Desiree Lim has put together a by-the-numbers bland-fest that's entirely forgettable. There was a time when merely having an openly homosexual protagonist was enough to make a mark on the screen. That time is gone. In this day we need quality as well."
tt0455590,"Before I begin, I want to briefly say that this movie in and of itself is very well made and well acted by all involved, including Whittaker, who indeed deserves his nomination. It is highly entertaining, and . . . taken in the right context as a work of FICTION, it is a very good movie. For that, I give it the two stars.<br /><br />However, rather than wasting your time with what you can read a hundred times elsewhere, I want instead to point out the absolute fictional nature of this film and how dangerous it is to sell people a work of fiction as if it is truth. I stress that this film nowhere in the credits lets us know that the main character, Dr. Nicholas Garrigan, is a complete invention of fiction. Rather, it presents this character into a real historical setting, and allows the uninformed viewer to assume he was in fact real, and what they are seeing is the truth. I have no problem with the blending of fact and fiction - but to do so in such a dishonest matter is, in a word, reprehensible.<br /><br />There can be no doubt that Africa, along with most Third World Countries is rife with human misery and suffering. Hollywood has long attempted to capture the suffering of people in these countries on film. But Hollywood also has its eye toward making money. The only true way to capture the suffering that seems to happen everywhere but the West is to either experience it for yourself, or to at least have it captured in an honest documentary.<br /><br />But these depictions of fictional characters in real historical settings can only do so much. At the end of the day, they become less about presenting the facts for the viewer to decide for himself, and more about leading you from image to image and hitting you over the head screaming, ""SEE, WE TOLD YOU IT WAS BAD!"" The seminal example of this can be found by anyone willing to watch the documentary on the DVD after sitting through the movie. Arguably the most shocking image of the film is the viewing of the body of Kay Amin, Idi's second wife, whom he killed when he discovered her infidelity. In the film, we see that her limbs have been severed and reattached in reverse (arms for legs and vice-versa). This is the director making sure you understand that Amin is, as the Gungans say, Bom-bad! But watching the documentary, we learn that this is in fact nothing more than a myth, which the sitting Minister of Health at the time himself tells us is not true.<br /><br />So . . . what . . . they just MAKE UP these things? Why? Because Hollywood has a low opinion of our intelligence, that's why! They don't trust us to come to the right conclusion ourselves. Look, that she was murdered and dismembered is in itself enough for us to conclude that Amin was not the likable guy he portrayed to the media - we don't need this Texas CHAINSAW MASSACRE inspired imagery to reinforce that! And this is just the tip of the iceberg. What is also not explained to the casual viewer is that lead character Garrigan is himself fictional. There was no young Scottish doctor taken under Amin's wing. As such, Garrigan is clearly present only for the sake of helping us dumb Westerners understand the African world. The producers seem to thing we won't be interested in a film about Africa unless there is a white face in it. (Ironically, even the titular character is portrayed by an American black actor!) The problem with this is that the movie is no longer an expose of Amin and his regime, but instead an exploitative thriller about a white Westerner coming to Africa for all the wrong reasons, making several horrible mistakes, and then ""redeeming"" himself, even at the cost of three other innocent lives. Honestly, I have to say it is nearly reprehensible to suggest that the real tragic death of Mrs. Amin was the result of a tryst with a fictional Scottish doctor - it almost seems to become a morbid joke for the sake of entertainment! I really wish Hollywood would stop jerking us around for our money. I first realized its propensity to do this with the woefully manipulative A BEAUTIFUL MIND, Ron Howard and Akiva Goldsman's sugary-sweet adaptation of the life of John Nash, which deleted the darker side of the man to present only the tortured hero that America just can't get enough of. The sad truth is that Hollywood has been selling us these fakes for years, and viewers, who are predictably and understandably too lazy or uncaring to investigate for themselves, buy these fake portraits hook, line, and sinker.<br /><br />Look, I'm certainly not suggesting Amin is being turned into a villain he wasn't. My point is, with the truth being so shocking enough to convince us of the brutality of the man, why must Hollywood then go to such fictional lengths? Why must Hollywood continue to insult us by holding our hands through these films? Why can they not trust us to think for ourselves!? Can we not just put the honest portrayals on screen and let the audience decide for themselves? I urge all who continue to watch Hollywood's purportedly ""true"" movies to do yourself the favor of ALWAYS investigating for yourself, and to NEVER assume that what is on screen is even close to the truth!"
tt0484437,"***LIGHT SPOILER ALERT*** The story sounds good and if you've read the novel, then you're probably expecting a deep and intense movie that could offer some insight for some interesting and insufficiently explored human relationships.<br /><br />True enough, the script tries to do that, the director tries to do that, but the main cast fails miserably. Maria's acting is so dry that lacks any feeling whatsoever, her most intense moments seem almost comical. Sometimes she seems to be nervous due to the camera. Her only really feeling scene is near the end where she gets dumped by her girlfriend.<br /><br />Ioana seems even more tense than Maria and even worse, she doesn't seem natural at all. Maria had the attitude, even if it was artificially pushed towards being obvious, but she had it and her character received some credibility. And to make matters worse, we don't have an insight on her: where does she come from, how come she got involved in the lesbian relationship, how did the relationship evolve? We only get some bits from her parents and their relationship just seems to 'be' there: it has a content and and end, but no beginning. Just like her partner Maria, she has only once scene that is truly touching, the scene where she dumps Maria's character Kiki.<br /><br />Tudor is the only person in this movie (aside from the landlady, great acting there) who manages to prove some acting talent. He has his character's attitude and it fits him. Only once or twice he seems to falter (the scene at his parents' meal, he tries to be obvious when it wasn't necessary at all).<br /><br />I love the story, Tudor Chirila is OK there, the landlady actually acts and Puya delivers his couple of lines with style, but this doesn't save the movie. Too bad, the entire setting had huge potential and the Romanian cinematography could've used a movie on this theme.<br /><br />Oddly enough, the incestuous relationship between brother and sister seems to have more credibility than the no-background no-feeling (well, Maria's spoken interludes are a nice try in this direction) lesbian relationship of Maria and Ioana. I'm quite sorry for spending money on a ticket, I'd rather had watched it from the comfort of my room."
tt0705295,"This is one of the few episodes (if not the only one) with an indisputable error in its storytelling. While handling the Ralphie situation Christopher states that he has heard about Pie-O-My's death in the fire accident. This is an important detail because in this context it is quite obvious that Christopher knows from the beginning that Tony is the one who must have killed Ralphie. There is however no way Chris could have heard about the accident. Who should have told him and when? By the time he is torn out of his delirium by Tony's call nobody else was informed. Tony knows that - which makes it even worse! Hearing Christopher talk about Pie- O-My's death could therefore only lead Tony to the conclusion that Chris himself has set the fire. Given the impressively elaborate writing process as told by the writers themselves on the DVD I really wonder none of them realized the problem there. The story just doesn't work that way. Unnecessary to add that I'm a huge fan of the Sopranos. Otherwise, I certainly wouldn't care."
tt0759482,"I'm basing this on my observations of one episode I saw last night (9/27/06). I don't think I'll be watching again. The acting was totally wooden, the plot completely predictable, the ending totally unrealistic -- I mean who would believe a 30 million dollar judgment for the death of a recovering drug addict with terminal cancer? The lead actor (Victor Garber) seemed so uncomfortable, almost embarrassed in his role -- perhaps he realized how bad the writing was!! I fully realize that the drama offered this season is pretty poor, but they can surely find better writers. Maybe they are outsourcing the writing to India or China!! I'll bet we won't be seeing this one next season!"
tt0783695,"... and yet, we were told, there was another hour and 20 minutes left to go.<br /><br />Why, oh, why wasn't there an editor to tell the writer/director to snip, snip, snip? Apparently that writer/director has previously done shorts; as a short, this would have been okay. But the lack of dialogue starts to grate after twenty minutes. The lack of much music glares. The background noises (talking, traffic, and especially a ubiquitous helicopter) get old really fast. But the worst failure is in story. There is precious little beyond a short.<br /><br />After an hour we saw variations of the same scene over and over again. I nearly screamed at the screen, ""We get it, we get it!!!!!"" It's amazing that after that left the theatre, we could drive home, watch the Daily Show and parts of the Colbert Report, get ready for bed,and know that the audience was STILL trapped in the theatre.<br /><br />It's not enough to indulge your vision. You have to give the audience enough to share your vision."
tt0787523,"Unfortunately I made a mistake and I paid 7 Euros at the movie theater to watch this shallow meaningless movie. My points;<br /><br />Film is based on 2 things;<br /><br />1) Ethnical point of View: As it happens on most of the American Films, the writer thinks itself as an expert after learning 2 or 3 things about the Asian culture. But unfortunately it is not enough. Knowing kunefe and 2 names of other foods doesn't make a person understand a culture. For example shaving is the sign of clean life in Asia but everyone was trying the girl to stop that. Lebanese people are Christian (Ok they got that) and their cultural forms and beliefs and approaches are completely different from other Arabic countries. The main difference between eastern and western culture is we don't make ethnocentrism. So we don't judge people after their first question about our life as the father figure did in all of the film. <br /><br />2) Sexual revolution of a girl: There is nothing much to say about this. Show me 10 girls which had these on their sexual awakening than I will say that I am wrong.<br /><br />I wrote this comment because the producers are promoting the film in the black humor genre. Please watch Dr.Strangelove and understand the meaning of black humor. A black humor has to reflect the truth and has to focus the audience to the funny parts of it. Where is the truth? Where is the meaning about the movie."
tt0841150,"Andy Lau stars in another cop undercover tale. Daniel Wu plays Nick who is working for the cops and is also close to the top of a drug dealing gang(Lau). The movie begins as we watch the police try to make a drug bust only to see it go to pieces. We then are introduced to the young drug addicted mother and her daughter living near Nick and to his cronies and the cops, and 45 minutes in I shut off the movie and put on the news. Well acted and great to look at this is as uninvolving a movie as I've seen in a long time. Its not bad as such its just you really don't care. I mean I really didn't care at all. I actually started to do something else completely forgetting I had on a subtitled movie on, thats how much I didn't care. I wish I could have hated the film but the film is such a nonentity that it made almost no impression on me (its not even something I could sleep to its just something to ignore). Come on the box called it the Chinese Scarface,what after he was dead? This is one to avoid."
tt0893406,"This is it. This is the one. This is the worst movie ever made. Ever. It beats everything. I have never seen worse. Retire the trophy and give it to these people.....there's just no comparison.<br /><br />Even three days after watching this (for some reason I still don't know why) I cannot believe how insanely horrific this movie is/was. Its so bad. So far from anything that could be considered a movie, a story or anything that should have ever been created and brought into our existence.<br /><br />This made me question whether or not humans are truly put on this earth to do good. It made me feel disgusted with ourselves and our progress as a species in this universe. This type of movie sincerely hurts us as a society. We should be ashamed. I really cannot emphasize that our global responsibility as people living here and creating art, is that we need to prevent the creation of these gross distortions of our reality for our own good. It's an embarrassment. I don't know how on earth any of these actors, writers, or the director of this film sleeps at night knowing that they had a role in making ""Loaded"". I don't know what type of disgusting monsters enjoy watching these types of movies.<br /><br />That being said, I love a good ""bad"" movie. I love Shark Attack 3, I love Bad Taste, they are HILARIOUS. I tell all my friends to see them because they are ""bad"".<br /><br />But this.......this crosses the line of ""bad"" into a whole new dimension. This is awkward bad. This is the bad where you know everything that is going to happen, every line, every action, every death, every sequence BEFORE they happen; and not just like a second or two before, I mean like, after watching the first 5 minutes before.<br /><br />Every cheesy editing ""effect"" is shamelessly used over and over again to a sickening point. I really never want to see the ""shaky"" camera ""drug buzz rush"" effect or jump cuts or swerve cuts or ANY FANCY CUT EVER AGAIN EVER. This is meticulously boring, repetitive and just tortures the audience.<br /><br />But.......and let me be specific here, the most DISTURBING thing about this movie is that given the production, it appears that a somewhat decent amount of money was actually put into this excrement. I personally will grab the shoulders of the director if I ever see him and shake him into submission, demanding that he run home and swallow two-gallons of Drain-O or I will do it for him.<br /><br />If we ever needed a new form of inhumane torture for our war prisoners abroad, just keep showing them this movie in a padded cell over and over again. Trust me, I think they will become more extravagant with suicide methods after the 72nd time of sitting through this.<br /><br />Stop these movies, they are just the most vile of all facets of our society. Please. Stop. NOW."
tt0925266,"Before starting to watch the show, I've heard it was great and aesthetically very interesting. What a deception, the scripts are so dumb that I am quite sure the authors are son and grandson of Scoobidoo writers. And what about the SFX and colors, they are so extreme that it is painful to watch, colors are not saturated they are over saturated, like scripts are overwritten and show is overrated. This show is like a bad pie in which a child would have put only sugar and butter thinking that because these ingredients are the best, they are sufficient. Unfortunately for this show, the only two ingredients of this show are finally vacuity and a total lack of credibility."
tt0932672,"I also saw this movie at a local screening about a year ago. First, I'm going to say that it looks great. Cassella is incredibly talented and a fantastic cinematographer. I just wish the movie had been as good as it looks. I would not call this a horror movie. Putting in a few shots of a decaying ghost does not make it a horror movie. There's no mystery, there's no suspense, you know who did it the entire time. <br /><br />It's a drama. You know what's going on with both sides the entire movie. The acting was okay, I guess, but nothing special.<br /><br />And the tagline, ""Revenge can be deadly""....really?...they should have check how many hundreds of horror/thriller movies have that exact same tagline?<br /><br />It pains me to say some of this, but I know a lot of the people who worked on this movie, and I know they don't want people blowing smoke up their ass, so I give my honest opinion."
tt0972412,"It looks like the brilliant team of Shonda Rhimes outsourced the writing of this one somewhere offshore, maybe to the MediocreLand? ""PP"" reminds me any one of the many tedious, promising at first but predictable within 1 season David Kelly flicks (Picket Fences, Ally McBeal, and now Boston Legal). The crazy cases they get are so outlandish, they barely evoke sympathy or sadness. And that's what actually makes good medical dramas tick - dramatic situations you are afraid of, ""This could be me"" sentiment. They are not funny either.<br /><br />The actors are quite good, but the plot lines are dead and cannot be brought back to live. I'm a therapist, and let me tell you - Amy Brennan plays the most unbelievably incompetent, unethical, untrained therapist. Whoever writes her stuff flunked the ethics and the transference/counter-transference courses in Stanford. Somebody should give them a Code of Ethics to read (the episode with the nose-bleeding wife and the therapist's involvement in it). No therapists are that bad.<br /><br />Women yearning for men who have moved on - had been done to death, we've all graduated ""Sex and the City"". Addison in her youthful aggression towards the guy she likes - very age-inappropriate, looks so unnatural on a woman over 40, and this otherwise talented actress doesn't believe it herself and doesn't deliver it very well. The only successful/palatable developments are Addison struggling with her decision to move to LA, and the ""Voodoo Dr"" and his coping with widowhood.<br /><br />This concept might work with a whole new writing team."
