tconst,review
tt0104997,"i don't know what they were thinking.by they,i mean anybody even remotely connected to this disaster.i've seen so bad movies,i've seen so really bad movies,and then there's this.but i will say one thing.whoever wrote the script has manged to put what could possibly the most inane dialogue over written,onto the screen.there is nothing good about this movie,either from a technical standpoint or any other standpoint.whoever allowed it to be made and then released should have been fired immediately.there are a few fairly well known names in this movie.actually i hesitate to use the word movie.it's more like a collection of random scenes that have no relation to another and make less than 0 sense.anyway,i fail to see why anyone with any dignity would appear in this.i got it really cheap,and i still got ripped of.even if i had gotten this movie for free,i would still have been ripped off.this is an absoluter 0/10"
tt0105629,If you are planning to rent or buy this movie don't. It's the worst thing I have ever seen. I would comment on it more but It has been 10 years since I saw it and have blanked all of it from my mind. Save yourself some time money and well being and stay far far away.
tt0106922,"I was unsure whether or not Andy Sidaris could repeat his success with the cinematic hit ""Malibu Express."" With his film Fit to Kill he has proved that Sidaris is a serious filmmaker and not just a one-shot director. The plot written by Sidaris, which was ungratefully passed up by the Academy, is a complex screenplay involving many unseen twists and turns. The main characters composed work for a sexually based radio station known as KSXY. Cleverly, KSXY is actually their secret headquarters. In ""Fit to Kill"" they confront their long-time nemesis Kane, who is trying to steal one of Russia's most prized diamonds. A well-written screenplay is not all, excellent acting by the cast helps to ensure this film as a cult classic. Panned by the critics and the box office, this film will be appreciated in years to come. It is now suffering the same fate as Clockwork Orange and Taxi Driver did, but in the future will undoubtly become recognized. I am disappointed no critic circles have recognized Andy Sidaris's trademark filmmaking. The costumes, the special effects, all help to compliment this already beautiful piece of filmmaking. It may do you best to ignore the dismal 3 rating on this film and go out and rent it for yourself. My personal rating is 10/10. The drama is as thick as the blockbuster Runaway Bride, and the action better or equal to the cinematic masterpiece Last Action Hero. Andy, keep up the good work."
tt0107302,"Distasteful, cliched thriller has young couple doing cross-country research on America's most infamous murder sites, becoming road partners with a dim-witted young woman and her snarling boyfriend--who is an actual psycho. Arty and alienating, the film's tone alternates between pouty pseudo-irony and silly flamboyance. Handsomely-made perhaps, but ultimately laughable. Brad Pitt's performance as the low-rent killer is godawful. * from ****"
tt0116061,"This wilfully bizarre adaptation of Borges short story is typical Cox. His strong visual sense is, as usual, undone by the appalling half baked acting of most of the cast. The film is definitely in the surreal tradition of Bunuel's Mexican period, and looks at times like a poor man's take on Lars Von Trier's Elements of Crime. Cox's apparent preference for single takes, jump cuts, and ambient sound recording all work against the film's effectiveness. Worth a look but ultimately disappointing."
tt0116499,"This is one of those cheaply made TV Movies were the characters seem to lose all sense. The premise of the story, the kidnapping of a son by the boy's father,is very good. But the story just seems to beggar belief. Whenever the mother is advised not to do anything you know fine well she is going to do it. It is a bit far fetched and not worthy of a viewing."
tt0118254,"What the hell is this? ""Kooky drama""? ""Lawyers in Loony Tunes Land""? The world's thinnest, most duck-faced actress (even more duck-faced and anorexic than Michelle Pfeiffer) overacts her bony butt off, making cretinous grimaces that would shame Bugs Bunny, in one of the most animated non-animated TV series ever. This is also the most annoying one-hour-format TV show ever, hence the worst.<br /><br />All the men act like pansies, and I for one refuse to believe that even hip big-city shysters are all as delta-male-like as this sorry (short) bunch. Wuss Peter MacNicol manages to be even more irritating than Calista Flockofducks with his fake Hollywood ""shshshs"" speech impediment: it's the sort of pseudo-inability to pronounce the letter ""S"" by turning it into a moronic ""SH"" that the likes of Jon Shtewart and Christian Shlater also practice with zeal. Watching MacNicol talk, I always wonder how come his jaw doesn't dislocate... Human facial anatomy was never meant to support the pronouncing of the ""SH"" sound more than three times per second. He is a medical wonder.<br /><br />This badly conceived and written legal-drama/comedy hodgepodge also features some very 90s PC. It has POLITICAL CORRECTNESS written with huge, neon letters. Is there anything more unrealistic than a bunch of LAWYERS being full of ideals, high principles, and moral fiber? Laughable, but that's the way defense lawyers have been portrayed in Hollywood since its inception. After all, what is more noble than defending a murderer, a rapist, or a thief? When a TV series as retarded as ""Ally McBeak"" starts preaching to America about how it should run the country, then it must be time for Paris Hilton to become President. ""Ally McQuack"" is both a product of recent and large-scale Western dumbing-down and a perpetrator of it.<br /><br />Those supposed touches of ""eccentricity"", like the UNBELIEVABLY annoying musical numbers, are unconvincing and embarrassingly unfunny. This is no Monty Python. Whatever ""new"" the talent-free makers of this garbage were aiming for, they failed with honours. ""Ally McBeak"" is a highly commercialized TV venture aimed at indiscriminating yuppies, bored housewives, and bipolar lawyers. It's yet another dull ""objection overruled sustained your Honour may I call the witness"" legalistic baloney that the American audiences seem to eat up with relish for some strange reason..."
tt0119653,"I hate this movie. It is a horrid movie. Sean Young's character is completely unsympathetic. Her performance is wooden at best. The storyline is completely predictable, and completely uninteresting. I would never recommend this film to anyone. It is one of the worst movies I have ever had the misfortune to see."
tt0119792,"STAR RATING: ***** Saturday Night **** Friday Night *** Friday Morning ** Sunday Night * Monday Morning <br /><br />Ray (Ray Winstone) has a criminal past, has had problems with alcohol and is now forming a drug habit that is making him paranoid and prone to domestic violence to his wife Valerie (Kathy Burke) who tries to hold the family together but ends up coming off more like a doormat. Meanwhile, her mother Janet (Laila Morse) is aware of Ray's son, Billy (Charlie Creed-Miles) and his escalating drug habit that is sending him off the rails. The film follows these despairable characters as they tredge along with their lives.<br /><br />It is said that the British seem to enjoy being miserable, and that would include watching films that entertain them this way. Films like Nil by Mouth highlight this. It's a tale of a broken family, torn apart by crime, poverty, booze and drugs, the kind Jeremy Kyle would lap up like a three course meal. It is also essentially a tale of self destructive men, three generations apart and each copying the other, tearing a family apart and women trying to hold it together, despite not being strong enough. If you pick up a little of what it's about from the off-set, you can see it doesn't promise to be cheerful viewing from the start and it certainly doesn't disappoint in this.<br /><br />It's true what everyone said about the performances, and the lead stars, Winstone and Burke, do deliver some great acting. We see Winstone lose it with his wife, beating her senseless after some more coke induced paranoia, breaking down during a phone conversation with her and unleashing a typical arsenal of f and c words when she refuses to let him see his kid. Likewise, in a private moment, we see Burke skillfully lose her composure on a staircase, the full impact of the night before kicking in.<br /><br />This is another of those films where there's no 'plot' to follow, as such, just a real life feel of these hopeless lives carrying on from one day to the next. It's been acclaimed by many (including the Baftas!) but it really was just too grim and bleak for me. I have no right to criticize it for this, knowing what I knew about it from the off-set, but sadly this is how I found it. **"
tt0120706,"This was a disappointing film. The people seem to have no substance, the lead protagonist Martin Cahil has zero redemptive values, in fact everyone in it including Jon Voight epitomizes sleeze. I would not recommend this film to anyone. The violence is distasteful, though artfully done. The filming is to black, at least the print i saw fit this category. A disappointment."
tt0127901,"This was a truly insipid film. The performances are third rate, and the dialogue is so stilted that at times it seemed to have just rolled over and died. My reason for renting this was simple: Find a movie with scriptwriting. I needed a visual aid for my presentation, so I figured why not use a clip? Boy was I wrong. After searching my local video store, I came upon this, where it was suspiciously titled ""Starstruck"". I thought, ""What the hey"", and decided to give it a try. Well, I was very unhappy with my results. There was maybe one scene I could use, and meanwhile, I was practically falling asleep because of the sheer banality of the flick. So.....I took this back and picked up Ed Wood. There's a movie I can use as an example. Then again, anything would be presentable compared to the drivel that is ""Starfucker""."
tt0132905,"Based on one of the books by Gabriel Marquez and it might be brilliant literature, this cinema-adaption really sucks as it's more like fighting against sleep rather than enjoying some cinematographic delices. The story is about an old couple whose son died and living a life that is heavily dominated by poverty, and wherein the main character is a cock that hopefully one day brings some money for a forthcoming cockfight. I am in no mood to spill more words on this useless pretentious piece, just perhaps that you can see Salma Hayek in here, but sitting 90 minutes in front of your screen for just that? No gracias....."
tt0164877,"I have to say I was really looking forward on watching this film and finding some new life in it that would separate it from most dull and overly crafted mexican films. I have no idea why but I trusted Sexo, Pudor y Lagrimas to be the one to inject freshness and confidence to our non-existent industry. Maybe it was because the soundtrack(which I listened to before I saw the film) sounded different from others, maybe it was because it dared to include newer faces(apart from Demian Bichir who is always a favorite of mexican film directors) and supposedly dealed within it's script with modern social behaviour, maybe because it's photography I saw in the trailers was bright and realistic instead of theatrical. The film turned out to be a major crowd pleaser, and a major letdown. What Serrano actually deals here with is the very old fashioned ""battle of the sexes"" as in ""all men are the same"" and ""why is it that all women...;"" blah,blah,blah. Nothing new in it, not even that, it uses so much common ground and clichè that it eventually mocks itself without leaving any valuable reflexion on the female/male condition. Full of usual tramps on the audience like safe gags about the clichès I talked about before(those always work, always) and screaming performances(it is a well acted film in it's context)..and by screaming I mean, literally. The at first more compelling characters played by Monica Dionne and Demian Bichir turn out to be according to Serrano the more pathetic ones. I completely disagree with Serrano, they shouldn't have been treated that way only to serve as marionettes for his lesson to come through...he made sure we got HIS message and completely destroyed their roles that were the only solid ground in which this story could have stood. Anyway, it is after all, a very entertaining film at times and you will probably have a good time seeing it (if you accept to be manipulated by it)."
tt0199650,This unpleasant film has little to recommend it. Dolph Lundgren gives a performance that is better than either this script or his other action films have allowed. And there are occasional snippets of dialog that suggest the film might have been able to provide some insight into a bizarre subculture.<br /><br />But no. Motivations are either murky or trite. Most of the acting is sub-par. The script creates needless confusion. And the director's needless fascination with focusing on gore is distracting.<br /><br />It's hard to imagine who the audience is for this film.
tt0244684,"Jochen Hick wrote and directed this little thriller of a suspense film based on the concept that the AIDS virus was a sheep virus mutated by the government to rid the world of gays and was apparently tested on convicts in the years before the outbreak of the hideous disease. Were it not for the poignancy of the concept of the film, this would fall into the category of the many films about the ruination of the world by a rampant non-prejudicial infective organism.<br /><br />Stefan (Tom Wlaschiha) journeys from Berlin to San Francisco to investigate his father's scientific suppositions about the induced sheep virus and its effects of the convicts in whom it was infused. He meets with some disdain and resistance to a dead theory, but also encounters some folks who know of the theory and support his investigation. Simultaneously with his visit a series of serial murders takes place, each victim killed in a similar manner and each murder apparently accompanied by strains of music from Puccini's opera 'Turandot' which just happens to be opening at the San Francisco Opera. A police investigator Louise Tolliver (Irit Levi) and her companion cop (Kalene Parker) follow the murders while Stefan makes the rounds of the sex clubs and bars in San Francisco trying to locate men who may have been guinea pigs for his father's theory. He encounters a strange lad Jeffrey (Jim Thalman) with whom he has a cat and mouse attraction and a prominent Doctor Burroughs (Richard Conti) who seems oddly involved in the cast of suspects. How this all come to an end is the play of the film, a story as much about the search for self identity between Stefan and Jeffery as it is a case for investigation of murders.<br /><br />While Tom Wlaschiha, Jim Thalman and Richard Conti do well with their roles (they are the only three who have any prior acting experience in the film!), the quality of the film sags considerably by the less than acceptable minimally talented Irit Levy and Kaylene Parker: when on screen the credibility of the story drops below zero. There are some small cameos by other actors that brighten the screen for the moments they inhabit, but in all the film is drowned by the incessant replay of 'Nessun dorma' as sung by Mario del Monaco from a recording o the opera - and that seems to be the reason for making the film! Good idea for a film and some good characterizations by the actors, but there is no resolution of the initial premise that started the whole thing. Grady Harp, February 06"
tt0301924,"Contrary to another reviewer, I think that this is WELL-written, especially the more fictional it is, because greater imagination would be required; and well acted, because there were no other characters with whom to share the focus of these dozen-minutes-plus, well-done monologues. But I'm just not entertained by such solemn, pious rememberances. Everybody has a story to tell and some are more interesting than others. Everybody has problems and some are more intense than others. These are just ten, not-very-atypical stories and problems, exemplifying how anybody's life (or part of it) is fodder for film. Then again, I think poorly of TV's reality shows, too. So, if that's your bag, you may like this. It's the kind of stuff that would make for good 'phone and/or internet gossip; but absolutely without other-than-verbal action. And, although each of the speakers is female, I'm gonna leave gender outta this."
tt0306597,"A film about the Harlem Renaissance and one author in particular. It contrasts it with a modern day story about a young, gay, black artist.<br /><br />If that sounds vague it's because the movie itself is. It's well-directed, fairly well-written and (for the most part) well-acted. Also the scenes in the past are shot in moody black & white. Also this is one of the few film dealing with gay men that does NOT shy away from sex scenes (not that explicit and no frontal). Still, I mostly hated this.<br /><br />The film meanders all over the place, is full of unlikable characters (including the main protagonist) and (this is the killer) moves at a snails pace. Three times I considered leaving the theatre because I was so utterly bored. But the director WAS there so I stayed. <br /><br />His talk afterwords shows this was a labor of love and took 6 years to complete. I really wish I could like this more (there are VERY few films dealing honestly with gay blacks) but I can't. Unless you're very interested in the Harlem Renaissance there's no reason to see this."
tt0328031,"A film without conscience. Drifter agrees to kill a man for a mobster for money. Then they double cross him. Meanwhile he falls in love with the dead man's wife, and, without her knowing he's the killer, moves in with her. Then he ""accidentally"" kills her when she finds out. Then, in a WALKING TALL kind of heroism, he gets revenge on the mobsters who double crossed him. The first problem is that, by agreeing to take on the murder by hire assignment, the drifter loses all sense of sympathy, worthiness, and heroism. We can't accept any goodness in him and as a result the rest of the has no moral center. We just can't care about that kind of guy. And the wife (nicely played by the fetching Kari Wuhrer - the sheriff in EIGHT LEGGED FREAKS), a high class lady who runs a mission for homeless people, similarly loses a degree of sympathy by jumping right into bed with the homeless drifter (despite her evidently weakened state after the death of her husband). And, when she finds out he's the guy  what does she do? She locks him inside her house (as if ALL houses had locks you can't open from INSIDE) with her and proceeds to berate him. Stoo-pid. George Wendt, however, is terrific in a role as a beefy thug. Director Stuart Gordon did so much better with RE-ANIMATOR and DAGON."
tt0344273,"""Kings and Queen"" is a bloated French drama that rambles on for an interminable two hours and thirty-two minutes to no discernible point or purpose.<br /><br />The film features two stories that seem unrelated at first but which eventually connect with one another about halfway through the movie. The first centers around Nora and her struggles with various men in her life, including an elderly father who discovers he has only a few days left to live. The other story involves a young man named Ismael, a violinist who finds himself placed - unfairly, he believes - in a mental institution through the machinations of an unknown third party. After traveling along on separate tracks for awhile, these two narrative strands eventually come together when we learn that Ismael is a former lover of Nora's and the man she has chosen to adopt her son from an earlier, tragic relationship.<br /><br />With a bit more focus and a considerable amount of streamlining, ""Kings and Queen"" might have been a potent, engrossing drama about modern day relationships. It certainly has moments of tremendous insight and emotional power, and the performances are, for the most part, complex and touching. But, taken as a whole, the film meanders and maunders to such an extent that, quite frankly, it begins to wreak havoc on our patience and to wear out its welcome early on. Even more distressing is the fact that, even though we spend what seems like a mild eternity in the company of these people, we really don't know quite what to make of any of them when the show is finally over. For instance, Nora's father, on his deathbed, writes a withering diatribe against his daughter's character that simply doesn't gibe with the woman we've been looking at for well over two hours. Nora is admittedly no Mother Theresa (then, again, who is?), but she certainly doesn't deserve the invective thrown at her by her very own father. Nora could be accused of being confused, indecisive, a bit self-absorbed at times, but evil enough to have her father wishing he could give her his cancer and make her die in his place? I don't think so.<br /><br />Perhaps this film is simply operating at a level of depth that I was unable to fathom. But my suspicion is that even writer Roger Bohbot and co-writer/director Arnaud Desplechin would have trouble fully explaining their purpose here. This is a well acted, pretentious bore of a film that takes the viewer on a long, rambling voyage through a sea of personal crises, a journey that leaves him no wiser or more enlightened at the end than he was at the beginning."
tt0346293,I watched this film few times and all i can say that this is low budget rubbish and that it does not have anything to do with a real history facts. Actors performances is very poor but it is result of limited acting possibilities. Anyone who watched this film now probably think of Hitler as some crazy skinny lunatic who running with a gun like some Chicago gangster. I can only to say that there is much better films about Hitler and Germany in those years and that Rise of evil is very much under average. I can recommend German film Downfall in which you can see brilliant performance of Switzerland actor Bruno Ganz in a roll of Adolf Hitler.
tt0346800,"Okay, I've tried and I've tried, but I STILL DON'T GET this Guy Maddin thing. Tales From the Gimli Hospital left me cold, that movie about the Austrian villagers and the one about the Ice Nymph were pretty to look but lacking in the story department...and this nudie movie about abortion and hockey is just boring. I'm glad Maddin has an appreciation for silent film, but I dislike his films for the same reason I dislike the films of Quentin Tarantino: they're empty homages to better, more imaginative films--films that advanced the art form or broke new ground--and are all style and no substance. No amount of jump cuts and odd camera angles can disguise the fact that Maddin is an unoriginal David Lynch wannabe, though he DOES have one advantage over Tarantino: he generally doesn't write embarrassing dialogue, because most of his films rely on intertitles. The bottom line is, Maddin's schtick is clever clever film-making for aspiring film majors."
tt0368078,"This guy has no idea of cinema. Okay, it seems he made a few interestig theater shows in his youth, and about two acceptable movies that had success more of political reasons cause they tricked the communist censorship. This all is very good, but look carefully: HE DOES NOT KNOW HIS JOB! The scenes are unbalanced, without proper start and and, with a disordered content and full of emptiness. He has nothing to say about the subject, so he over-licitates with violence, nakedness and gutter language. How is it possible to keep alive such a rotten corpse who never understood anything of cinematographic profession and art? Why don't they let him succumb in piece?"
tt0369084,"I've always been enthusiastic about period dramas, an art form in which the BBC has excelled in the past. This presentation of ""Byron"" was unbelievable. Unbelievably bad! The script was dreadful, the acting uninspired, and all the characters woefully insipid. Apparently Byron was ""mad bad and dangerous to know"", and set the ladies hearts all-a-flutter. Not in this production. Here he appeared as a tawdry jumped-up little squirt instead of a fiery hero of womenfolk and the Greek struggle for independence. It is said that Byron walked with a limp. This portrayal of the man was just limp all over.<br /><br />I watched the whole two and a half hours waiting for something to spark into life. Not a splutter, not even a glimmer. It was utter tedium, if not downright boredom, from start to finish.<br /><br />Having the opinion that no-one will ever better the Bard of Avon, I also believe that Byron's poetry is over-revered and to my mind should be flung on the back burner, and this dramatisation of his life should be accorded the same treatment.<br /><br />I think the BBC lost its nous with this one"
