tconst,review
tt0267440,"OK, a slasher movie. a very, very stupid slasher movie.<br /><br />We got your stereotypical teenagers in a house thing going. We got a FBI agent that's seen Dirty Harry one time too many. ""So what's the secret....punks?"" We got about 4 different little camera shots and scene that make no sense at all. ""Hey man, i'm fixing the sprinklers"" ((that guy was my favorite part of the movie)) Suddenly there's a preacher tied up on a couch watching home movies, he gets killed.<br /><br />they follow the killer into the middle of nowhere, with no cops. suddenly she's in a church, wearing a wedding dress. i swear this is the stupidest slasher movie i've ever seen."
tt0268288,"I just saw this movie, and I have to say that it was a big waste of time. The girl who played Eva (Ellen Fjaestad) can't act at all. She read her lines very un-naturally, and she had a very un-natural facial expression through the entire movie. Rosanna Munter who played Petra on the other hand, is a natural. She played her part with great perfection.<br /><br />SPOILERS! The story was simple - we've seen it many, many times before. She breaks up, he finds another, she get jealous, he breaks up with the other girl and they end up back together in the end. There were no surprises at all, one knew that Eva would break up, and that Adam would ""hook up"" with Petra. The only thing that nobody saw coming was that Petra told Adam to go after Eva at the party. She became all serious, which is a side of Petra the viewers hadn't seen earlier in the movie, and told him to win Eva's heart back, which was really cute.<br /><br />Besides Rosanna Munter, there isn't a single actor who gives a memorable performance.<br /><br />This is a mediocre movie with mediocre actors, so I don't recommend it!"
tt0269376,"The plot is plausible but banal, i.e., beautiful and neglected wife of wealthy and powerful man has a fling with a psychotic hunk, then tries to cover it up as the psycho stalks and blackmails her. But, what develops from there is stupefyingly illogical. Despite the resources that are available to the usual couple who has money and influence, our privileged hero and heroine appear to have only one domestic, their attorney and local police (who say they can do nothing) at their disposal while they grapple with suspense and terror. They have no private security staff (only a fancy security system that they mishandle), household or grounds staff, chauffeurs, etc. Not even, apparently, the funds to hire private round-the-clock nurses to care for the hero when he suffers life-threatening injuries, leaving man and wife alone and vulnerable in their mansion. Our heroine is portrayed as having the brains of a doorknob and our hero, a tycoon, behaves in the most unlikely and irrational manner. The production is an insult to viewers who wasted their time with this drivel and a crime for having wasted the talents of veteran actors Oliva Hussey and Don Murray (what were they thinking?). And, shame on Lifetime TV for insulting the intelligence of its audience for this insipid offering."
tt0272950,"My girlfriend once brought around The Zombie Chronicles for us to watch as a joke. Little did we realize the joke was on her for paying £1 for it. While watching this film I started to come up with things I would rather be doing than watching The Zombie Chronicles. These included:<br /><br />1) Drinking bleach 2) Rubbing sand in my eyes 3) Writing a letter to Brad Sykes and Garrett Clancy 4) Re-enacting the American civil war 5) Tax returns 6) GCSE Maths 7) Sex with an old lady.<br /><br />Garrett Clancy, aka Sgt. Ben Draper wrote this? The guy couldn't even dig a hole properly. The best ting he did was kick a door down (the best part of the film). This was the worst film I have ever seen, and I've seen White Noise: The Light. Never has a film had so many mistakes in it. My girlfriend left it here, so now I live with the shame of owning this piece of crap.<br /><br />News just in: Owen Wilson watched this film and tried to kill himself. Fact.<br /><br />DO NOT WATCH"
tt0273253,"I think this is almost all I need to say. I feel obliged to explain my actions though. I've basically never seen such an armateur production, and I mean that in all senses of the word. Although the physical camera work, boom MIC operation and other technical aspects of this film are laughable, unfortunately its not the only areas.<br /><br />Unlike some classic independent films that have been saved by their scripts great characterization and plot, this unfortunately has an awful script, awful acting and worst of all, awful annoying characters.<br /><br />It's a crime that for the every independent film that gets, distribution like Haiku Tunnel, there's a 101 other indie films that died silent deaths. I don't know who the Kornbluth brothers know at Sony, but that can be my only explanation as to how this amateur family production ever got distribution. I'm quite bemused as to why they picked this up.<br /><br />The ONLY part of this film that holds out any intrigue is its title. However, the reason for that is even a let down. I hope this review will save a few people that may be intrigued by this films title from going to watch it. I've seen a lot of films in my time, and I'm very forgiving when in the cinema, but this was too much. I'll never forget 'tunnel', for marking an important point in my life experience of cinema. Shame it's such a low point.<br /><br />"
tt0273607,"<br /><br />I recently viewed this atrocity in my film program, and I thought it was awful, as I said in my tagline, it was pretentious, trite, petty and phenomenally self-important.<br /><br />I consider myself a fan of film, and all the things that film has to offer. If I want to watch a documentary on the Cannes Festival, I will watch A&E....and they would probably be alot more objective about it.<br /><br />I dont recommend it, period.<br /><br />"
tt0274321,"Words can't describe how bad this movie is. I can't explain it by writing only. You have too see it for yourself to get at grip of how horrible a movie really can be. Not that I recommend you to do that. There are so many clichés, mistakes (and all other negative things you can imagine) here that will just make you cry. To start with the technical first, there are a LOT of mistakes regarding the airplane. I won't list them here, but just mention the coloring of the plane. They didn't even manage to show an airliner in the colors of a fictional airline, but instead used a 747 painted in the original Boeing livery. Very bad. The plot is stupid and has been done many times before, only much, much better. There are so many ridiculous moments here that i lost count of it really early. Also, I was on the bad guys' side all the time in the movie, because the good guys were so stupid. ""Executive Decision"" should without a doubt be you're choice over this one, even the ""Turbulence""-movies are better. In fact, every other movie in the world is better than this one."
tt0275410,I found Horrorvision almost unwatchable. While only 70 minutes in length I still found myself hitting the fast forward button again and again. The acting was of the `if I scream and say ***k a lot I'm intense' school. And the story was at best a scenario that had yet to be fleshed out.<br /><br />While I never go to Full Moon for great film making I have never seen them produce as bad a piece of junk as this.
tt0283974,"This movie was made-for-TV, so taking that into account, I'm not going to rip into it as hard as I would a feature film. The script is sub-par, but it does succeed in being mildly humorous in spots, whether it means to be or not. The acting is mostly over-the-top, but that is true for many lower-budget movies.<br /><br />The aspect of this movie that I really hated, though, was that 90-95% of it is shot on film, but in random places, there will be 5-10 seconds where the footage is shot on video. You can tell because there is less contrast, the colors are less vivid, and the footage is clearly 30 frames per second instead of film's 24 frames per second. I'm not sure if maybe these scenes had to be shot later and at that time they didn't have the money to shoot on film (I assume this is why, anyway), but it is disorienting and really makes the film look shoddier than it had to look.<br /><br />Anyway, I've definitely seen worse movies, but I definitely wouldn't say that I enjoyed this movie and I can't recommend that anyone see it."
tt0284137,"Gadar is an example of one of Bollywood worst overrated movies ever. Directed by Anil Sharma, who prefers making period related movie gives a rubbish movie. The songs were boring and ain't the kind of song you want to listen to in your car, full volume. Sunny Deol is famous for making daft movies, where he beats up a 100 bad guys on his own. He even kicks a metal jail door (Indian) and kicks a moving car far away (Teesri Aankh). I can give another 50 examples of disgraceful action by Sunny Deol. But I'm sure most people know this already. Sunny gives a pathetic performance once again repeating the same type of role. A guy claiming to be fighting for his countries piece, by using violence. Amisha Patel is hands down dead sexy with an amazing body that i would love to bone. But even she couldn't save the film from being a disaster. Instead of wearing sexy clothes like she usually does, in this movie she doesn't. Maybe cos she was playing a Muslim, but she doesn't act like one in the movie. Overall, this is a poor show all the way, I'm sure it will appeal to some people, who love seeing the Bollywood actor beat up 100 guys. Give me a break."
tt0284717,Im still in doubt if this is just a horrible movie or the worse movie i ever saw. Actors are painful and its impossible to get into the text.<br /><br />Don't waist your time into this movie. By submitting this comment you are agreeing to the terms laid out in our Copyright Statement. Your submission must be your own original work. Your comments will normally be posted on the site within 2-3 business days. Comments that do not meet the guidelines will not be posted. Please write in English only. HTML or boards mark-up is not supported though paragraph breaks will be inserted if you leave a blank line between paragraph.By submitting this comment you are agreeing to the terms laid out in our Copyright Statement. Your submission must be your own original work. Your comments will normally be posted on the site within 2-3 business days. Comments that do not meet the guidelines will not be posted. Please write in English only. HTML or boards mark-up is not supported though paragraph breaks will be inserted if you leave a blank line between paragraph.
tt0286610,"While it's early to say how the series will evolve, I can say that the pilot was less than I thought it would be. There is still potential for the series, however. Of course when I first saw Voyager I thought it had potential, too - but was sorely disappointed. My gut tells me Enterprise won't be as bad as Voyager, however.<br /><br />As for the impressions of the pilot...<br /><br />The pilot had some good ideas and good themes. I liked the introduction. The show's opening credits were interesting, with the progress of exploration and a fitting theme song. Scott Bakula is excellent in the role of captain.<br /><br />Where it fell short for me was largely that the story lacked the ""feel"" of setting out on a grand adventure. The plot of the episode itself was more a ""generic"" Trek story with the themes of ""exploration"" and ""first step towards space"" merely subplot and subtext. Were you to edit out the references to this being the first deep space mission, the plot would be hard to differentiate between the eras of Enterprise, TOS or TNG. The central plot didn't reflect or do justice to the grand theme of the series.<br /><br /> The plot of launching the first mission would have been grand enough without the ""action"". Instead of isolated references to the newness of exploration, they could have been the story. Get a little more nostalgic and philosophical about it (oh, for a TV show that once again would make us THINK). Make us feel the excitement of ""the wind"" and being on ""the sea"" instead of distracting us with a rescue and a plethora of gunplay. There was WAY too much gunplay.<br /><br />We had the feeling more that humans were the ""freshmen"" in an established school. New kids on the block, as opposed to venturing into a largely unknown universe. Sadly, the Klingons landed on our doorstep instead of us finding them. That meeting could have been far more historic and far more sociological. Just how DO two such different societies interact? Don't just hint about it, SHOW it!<br /><br />I had to think of it more as `Trek with an akward crew and limited technology' as opposed to `the first brave steps into the unknown'. I wanted to see something newer and fresher. The series promises to have a new concept but so far I haven't seen this new, great concept.<br /><br />I will conclude with reiterating the sentiment that the series has potential. There are some interesting characters. Bakula is wonderful. Blalock has potential. The overall theme is the most interesting since we first saw Kirk in a world before Apollo 11. If only future episodes can do justice to this grand and wonderful theme, we will have a show which will create new legends.<br /><br />You shoot an arrow into the air... Good luck Capt. Archer.<br /><br />To the producers: TAKE MORE RISKS AND MAKE US *THINK*! :-)"
tt0286975,"I have read several good reviews that have defended and critised the various aspects of this film. One thing I see, over and over, is annoyance with Megan, the idealistic political scientist, trying to change the world. I loved her character. Maybe, because I am a 23 year old political science student and I think I'm going to change the world too, so I relate to Megan. Besides, she's cute. She's no super model, but more of a cute girl next door.<br /><br />OK, so she cried and screamed a lot. It's very dramatic, and seems overdone, but doesn't it fit her character? She goes on that show with the intention of sacrificing her life to prove a point. She thinks people who enjoy such a show are sick. I think she made her argument very well. Of course, being a young naive girl, she is terrified of what she is about to face. I think her acting accurately portrays a young girl showing moral courage despite her overwhelming fear. Furthermore, I think she maintained a certain dignity throughout the film despite the desperate situation she was in.<br /><br />As for the movie in general, other than Megan, it was pretty much what I expected. It had excellent gore scenes, by micro-budget standards. The plot maybe took a quick thought, hardly any contemplation. It's basically just a dark humorist senseless slasher film, which the name implies. I love the sadism of the doctor. He kept ripping Megan's shirt off, not just for the cause of sleaze (though largely so), but also to torment her, before he kills her. The Chainsaw hick was hilarious. For slasher film lovers, he was probably the best character.<br /><br />I give this film 4 out of 10. It had a good setting, almost no plot, and a mix of good and terrible acting. I would recommend it for a cheap thrill, but hardly a diamond in the rough that is micro-budget horror."
tt0290661,"I once promised never to walk out of any film ( a personal policy that made me suffer through the most different kinds of dreck, such as Rambo 3, Baise Moi, Deep Impact) - but Mr. Seidl almost succeeded. Hundstage was a truly awful experience. Anyone who sees this movie will think that Austrians are a miserable, pathetic bunch of retards. It shows a world where love and humanity don't exist, a world where people humiliate each other only for one reason - to distract from their own miserable existence. By choosing a documentary-like style with non-professional actors (most of them look like straight from the imagination of Austrian shock-cartoonist Deix) director Seidl wants to make us believe that this is real life in Austrian (European? Western?) suburbs. The viewer is confronted with depictions of sex orgies, violence against women and handicapped people, madness and degradation. But this isn't social criticism. This is just pure shock without any aesthetic value. Instead you get bad acting, bad cinematography, bad filmmaking. If anybody needs a film like this to realize that there are things wrong in our society then this person must have walked through life with closed eyes. This is pseudo-social criticism with a sledge hammer. And it looks down on people in a disgustingly condescending way. It shows ugly people - that is not the reason why I hate it. But it depicts average people in an ugly, misanthropic way. And this is why this film is truly despicable."
tt0299594,"80 minutes, and it felt twice that long! Brief Crossing is not brief enough. Indeed, the first 50 minutes or so consist almost entirely of a dialogue (more of a monologue, really) of a woman approaching middle age, tediously droning about ""men,"" disappointment, sex, aging, and her recent breakup, to a French teenager she met in the ship's cafeteria.<br /><br />The tedious monologue continues as they go to duty-free shop, and to a bar, where finally her self-involved rant pushes him away. The ""story"" can't end there, of course, so she persuades him to listen to her drone on more as she brings him to her cabin.<br /><br />What little romance, sex, or for that matter, anything at all this film has besides bitter rantings is hardly enough to justify the price of a rental unless you are one of those who love dramas where nothing interesting happens at all. Yes, the ending is very nicely done, but it is scant reward to subject yourself to what amounts to a turning your living room into a virtual therapy session with a narcissistic whiner.<br /><br />Of course, some people like it. I could be wrong."
tt0301163,"Ok I will sum up this movie... A bunch of skanky British women have some disease that basically is turning them into zombies. The whole movie consists of these women talking, smoking, and rarely going out for ""meat"" Or humans to eat. I swear I had to MAKE myself watch this movie... UGH"
tt0306568,"Trash/bad movies usually ain't bad because I will find them enjoyable. This one is so bad that I am out of words to describe it - its below ""bad"". There is an instruction in the beginning of the film that tell you what to do during the movie. Needless to say, the instruction and a dozen of beer couldn't help me seat through the entire film. One tagliner compares this one to KILLBILL which is certainly unthinkable and an insult to our intelligent. Obviously. this tagliner had a plan to tempt you into buying this DVD.<br /><br />If you are considering renting this one, put it down! If you are thinking of buying, Dont think! If you unlucky to have this dvd, dont play it, throw it in trash bin immediately."
tt0379186,"From the blocky digitised footage to the acting that makes Keanu ""I'm so wooden I could be a Plank me"" Reeves look like an Oscar winner this film bites (pun not intended). The best thing about it is the box of eRATicate in the 2nd segment (which out of the three seemed to be the strongest piece in terms of storyline and 'twist'). Wish I'd spent the £3.99 it cost me on something else, like erm.... Natural Born Killers: Directors Cut. If you do buy this, you're really in for a disappointment, do yourself a favour and avoid it like the plague. If you're looking for something amateurish and with actors that are more wooden than a 2x4 then go ahead. However if you want some quality werewolf action look elsewhere, like Dog Soldiers, Wolfen, Romasanta:The werewolf Hunt."
tt0385586,"I have a high tolerance for the weird, but frankly some movies go way, way beyond weird--so far that they make your brain hurt. This is such a film. Trying to understand it or even explain it is impossible and I think the film is best understood while taking drugs--it's that incomprehensible.<br /><br />The film begins with some very cute Japanese animation involving a cat. However, out of the blue, tons of twisted and occasionally disturbing things occur--making me wonder if I am losing something in the translation. However, even if this is so, why did we need to be treated to images of a magic trick involving dismembering a lady with a clever, defecation, puking, lighting animals on fire, etc.. All this really seemed random and pretty awful. Oddly, and I don't know why, some see this as a work of genius. I just don't get that."
tt0446557,"I am a 11th grader at my high school. In my Current World Affairs class a kid in my class had this video and suggested we watch. So we did. I am firm believer that we went to the moon, being that my father works for NASA. Even though I think this movie is the biggest piece of crap I have ever watched, the guy who created it has some serious balls. First of all did he have to show JFK getting shot? And how dare he use all those biblical quotes. The only good thing about this movie is it sparks debates, which is good b/c in my class we have weekly debates. This movie did nothing to change my mind. I think he and Michael Moore should be working together and make another movie. Michael Moore next movie could be called ""A Funny Thing Happened on Spetember 11th"" or ""A Funny thing happened on the way to the white house""."
tt0023753,"This is one of those films that I could only sit through once. Charlotte Henry is fine -- in fact, all the actors were fine. The problem was in the script, the dialog, the direction, the editing, the sets and the special effects. Granted, this was 1933, but it really creaked. Part of the problem is that actors like Richard Arlen, Gary Cooper, W.C. Fields and Cary Grant are not recognizable (there faces cried for a recognition that was not forthcoming). The movie just clumped along with no cohesion. Much of Lewis Carrols spirit, humor and continuity are missing. What a pity! It's such a great book. I would recommend Disney's 1951 version."
tt0033771,"Roy Rogers stars as Jesse James and his look-alike, gambler man Clint Burns. George ""Gabby"" Hayes is Mr. Rogers's ex-pal, Sheriff Gabby. Gale Storm (Jane Fillmore) and Sally Payne (Polly Morgan) are a noteworthy team, as two reporters on the lookout for stories about the elusive outlaw hero.<br /><br />Of course, mistaken identity / impersonation is a plot development, since Rogers essays a ""dual role"". Rogers is charming, as usual; but, there is nothing really elevating this his performance above the ordinary - any potential to deliver a memorable Jekyll/Hyde performance is done in by poor material. The better pair to watch are Ms. Storm and Ms. Paye as the St. Louis Journal reporters - they are the film's highlight. The songs are fine, though badly synched. <br /><br />*** Jesse James at Bay (1941) Joseph Kane ~ Roy Rogers, George 'Gabby' Hayes, Gale Storm"
tt0037382,"Or ""Marlowe At Sea"". Yet another ridiculously overrated old film with Bogey. Quite talky, too. Bogey basically plays the same character as in the Marlow films; always in control of a situation, never nervous - no matter how dangerous a situation, calls women ""slim"" and ""dames"" and other such nonsense, is the only ""real male"" i.e. alpha male in the movie (the only other alpha male male being the head of Gestapo - but he is only a fat alpha male male), and - naturally - every attractive young woman who comes his way cannot resist his charms and wants his penis within hours of their initial introduction. The character clichés are all here. Bogey is supposed to be the same type of cynic-about-to-reform as in ""Casablanca"", and naturally he often refuses money or other valuables when being offered them - but how does that fit in with the tough cynic in him? It doesn't, so he can't be a cynic; Hawks wanted it both ways: a character who is both the ""cool lone cynic"" and yet a well-meaning humanitarian. I don't think so... Bacall does her non-chalant ""cool babe"" routine for the first time, and there are plenty of overrated, not all-too interesting so-called ""sexual innuendo"" exchanges between her and Bogey; these dialogues sound silly by today's standards. ""Just purse your lips and whistle..."". A load of crap... She was 19 when this was made but looks a lot older, and is far less attractive than the female stars of the day. Her bony face, with its sharp features, is nowhere even close to radiating the kind of feminine beauty of a de Havilland, the cuteness of a Myrna Loy, let alone the likability of an Irene Dunne. Bacall was more suited for playing vampires, not femme-fatales. (In real life she is very much like her face: a Hollywood bitch.) There is a scene in which Bacall breaks into tears; very unsuitable for her character. There are two or three bad musical numbers - but my fast-forward button was ready.<br /><br />If you're interested in reading my ""biographies"" of Bogart, Bacall, Huston, and other Hollywood personalities, contact me by e-mail."
tt0039111,I don't know if the problem I had with this movie is that I was not able to capture the way movies were done in the past but I believe that this one did not miss to make use of any of the the fashionable conventions available in the 40s to make a film. If you don't have anything better to do my advise is not to watch this movie but to read a book or to go out for a walk.
