movie_id,title,director,year,runtime,genres,review
tt0197570,The Hungry Bachelors Club,Gregory Ruzzin,1999,93,"Comedy,Drama,Romance","I have to agree with some of the other comments and even go a step further. <br /><br />Nothing about this film worked, absolutely nothing. Delmar our central character makes the decision to become a surrogate mother in order to earn enough money to buy a restaurant but along the way fall for a wise ex-jailbird. At the same time her friend Hortense is trying to get her lawyer boyfriend to finally marry her. She also happens to be sleeping with Marlon who is desperately in love with her. Then there's Delmar's brother Jethro who gets involved with a former coke addict, Missy who reveals she was sexually abused by her adopted father. On the sidelines we also have the eccentricmother who has an assortment of equally odd friends, one of whom dies on the couch at the beginning of the film. So far so good but after introducing these characters and story lines addressing life, death, grief and love in the first half, the film simply loses direction. <br /><br />If the writer had only selected one or two characters and allowed us to follow their stories maybe things would have been fine but equal screen time is given to all with the result that no one story or character is fully developed. For instance, why does Delmar think she will be able to hand over her child in exchange for money, especially when the prospective parents are a creepy bigoted lawyer and his semi alcoholic and depressed wife? Why is Hortense so desperate to marry a man who is a jerk and clearly doesn't love her? How is it Missy manages to kick her coke habit overnight? Is Jethro regularly drawn to women with overwhelming problems, or is Missy the exception? Has Delmar and Jethro's mother always been on the eccentric side, or is it a more recent development? Why is Jethro so keen on Cadillacs that he has one in the middle of his living room? Why did Moses spend years in prison for stealing a car, a relatively minor crime? How does Delmar manage to end up giving birth to Moses' baby when there is no suggestion that they ever had sex? <br /><br />These questions are posed in the screenplay but sadly are never answered. I can only assume they were answered in the original novel and that is why the writer felt the need to include it all in the script. Big mistake. Losing several subplots especially the Hortense and Marlon story, which adds nothing to the overall film, would have tightened things considerably and allowed more time to develop the Delmar, Jethro and Moses characters who are clearly more central to the plot and underlying themes than anyone else. <br /><br />Add to that the most pedestrian directing style seen outside of the average soap opera and the result is a huge missed opportunity for all, including Jorja Fox who does her best to rise above the material. I'm not surprised that this appears to have been the director's last film as this effort shows no evidence of a visual style or ability to tell a moving and intelligent story."
tt0200710,Hitokiri,Hideo Gosha,1969,140,"Action,Biography,Drama","Many of the lead characters in Hideo Gosha's 1969 film ""Hitokiri"" (manslayer; aka ""Tenchu"" -- heaven's punishment) were actual historical figures (in ""western"" name-order format): Ryoma Sakamoto, Hampeita Takechi, Shimbei Tanaka, Izo Okada, ____ Anenokoji. The name ""Hitokiri,"" a historical term, refers to a group of four super-swordsmen who carried out numerous assassinations of key figures in the ruling Tokugawa Shogunate in the mid-1800s under the orders of Takechi, the leader of the ""Loyalist"" (i.e. ultra-nationalist, pro-Emperor) faction of the Tosa clan. What was this struggle about? Sad to say, you won't find out in this film. ""Brilliant History Lesson"" indeed!<br /><br />No, Gosha is much more interested in showing you the usual bloody slicing and dicing and (at absurd length) the inner torment of the not-very-bright killer Izo Okada than in revealing actual history. Sakamoto, for example, was someone of historical significance, considered to be the father of the Imperial Japanese Navy. The closest Gosha comes to providing a history lesson is the scene in which Sakamoto, whom Takechi considers a traitor to the Loyalist cause, comes to Takechi's mansion to try to sway him ideologically. He begins by talking about the international political situation, with foreign warships in Japan's ports and a Japan that is too weak militarily to defend against them. Want to know more? Sorry. Gosha cuts off this potentially fascinating lecture in mid sentence(!). So much for informing his audience about a turning point in Japanese history.<br /><br />The film left me in utter confusion about the aims of the two sides in this struggle. For the two and a half centuries that the Shogunate held central power in Japan, it was an institution dedicated to preventing social change, to preserving the feudal relations of society. It was fearful of outside contamination, both ideological and technological. In keeping with this spirit, it outlawed firearms, those instruments of ""leveling"" in Europe and the Americas, with which a peasant could have stood up to a samurai. Throughout this period, the Emperor was nothing more than a spiritual figurehead.<br /><br />But, in the towns, which stood in neutral zones between the feudal fiefdoms, a new class of merchants, landlords and craftsmen was developing -- the class known in Europe by its French name, the bourgeoisie. Inevitably, as this new class gained strength, it chafed against the many confines of feudal society. As in Europe, the king (Emperor) became the central figure in the bourgeoisie's struggle for power against the feudal aristocracy. But a political leadership does not always fully understand the interests of the class it serves. When the outside world arrived with a bang in 1853, in the form of U.S. Admiral Perry's ""Black Ships,"" the ruling elite of Japan was thrown into a crisis. Their military was no match for these foreigners. Also, they had heard about the havoc the British and French imperialists were wreaking in China. What should Japan do to save itself from the fate of its weak neighbor? Surprisingly, some elements within the usually isolationist Shogunate were inclined to open trade with the foreigners in order to obtain some of their advanced technology. This is the point of view represented (just barely) in the film by Sakamoto. On the other hand, the Emperor-loyal ultra-nationalists, represented by Takechi, believed they could keep out the foreigners by force, if only they could prevent the other faction from ""selling out the country."" (Sound familiar?) Thus, the assassination of key Shogunate figures is in order -- and away we go.<br /><br />Takechi's motivations were, for me, the film's biggest puzzle. Gosha suggests that he is fighting mainly for his personal advancement rather than for the Loyalist cause. Can we take this to represent the tenor of the Loyalists as a whole? (Do you care?)<br /><br />Several reviewers have compared this film favorably with ""Goyokin,"" which Gosha made in the same year. But, where ""Goyokin"" is a crackling, suspenseful, adventure yarn, with a hero worthy of sympathy, ""Hitokiri"" is plodding, nowhere near as compelling and lacks such a hero. Sakamoto could have been this film's hero but we are not allowed to know him -- nor what he stands for -- well enough for him to achieve that status.<br /><br />In view of his wonderful scores for five previous Kurosawa films, Masaru Sato's score here was very disappointing, sounding like something rejected from a ""Bonanza"" episode.<br /><br />Barry Freed"
tt0201290,The Underground Comedy Movie,Vince Offer,1999,88,Comedy,"A series of painfully unfunny skits that seem to go on forever and a day. Not as mind-numbingly awful as say ""Freddy Got Fingered"" or ""Lost Reality"", but that in NO way is an endorsement in ANY way, sense or form. Features the worst rhyming clown ever. Any most if it isn't offensive to anybody but the most prudish or politically correct. It also has the worst song parody EVER put on film, the WORST Arnold impersonation EVER (not just the worst put on film, literally the worst EVER). I have NO clue why Karen Black, Micheal Clarke Duncan, or Slash would star in this (the reasons I watched this in the first place) The only thing mildly amusing was Dickman. In conclusion I would't recommend this film to ANYONE, but the people who are making it their mission in life to get this in the Bottom 250 on this site are pathetic. Do something notable with you lives people. Plus if it's true the Church of Scientalogy hates him, he can't be ALL bad.<br /><br />My Grade: D"
tt0202152,Zatoichi,Shintarō Katsu,1989,116,"Action,Drama","This is to the Zatoichi movies as the ""Star Trek"" movies were to ""Star Trek""--except that in this case every one of the originals was more entertaining and interesting than this big, shiny re-do, and also better made, if substance is more important than surface. Had I never seen them, I would have thought this good-looking but empty; since I had, I thought its style inappropriate and its content insufficient. The idea of reviving the character in a bigger, slicker production must have sounded good, but there was no point in it, other than the hope of making money; it's just a show, which mostly fails to capture the atmosphere of the character's world and wholly fails to take the character anywhere he hasn't been already (also, the actor wasn't at his best). I'd been hoping to see Ichi at a late stage of life, in a story that would see him out gracefully and draw some conclusion from his experience overall; this just rehashes bits and pieces from the other movies, seasoned with more sex and sfx violence. Not the same experience at all."
tt0240736,Moonstalker,Michael S. O'Rourke,1989,92,Horror,"IT IS So Sad. Even though this was shot with film i think it stinks a little bit more than flicks like Blood Lake, There's Nothing Out There & . The music they play in this is the funniest stuff i've ever heard. i like the brother and sister in this movie. They both don't try very hard to sound sarcastic when they're saying stuff like ""My friends are going to be so jealous!"" Hey, whats with the killer only wearing his mask in the beginning? Thats retarded! I practically ignored the second half of this. My favorite part about this movie is the sound effect they use when the killer is using the axe. The same exact sound for every chop!"
tt0249624,Gabriel & Me,Udayan Prasad,2001,84,Drama,"I almost made a fool of myself when I was going to start this review by saying "" This movie reminded me of BILLY ELLIOT "" but then I looked up the resume of screenwriter Lee Hall only to find out that he was the guy who wrote BILLY ELLIOT so it's Mr Hall who's making a fool of himself not me <br /><br />Am I being a bit cruel on him ? No because Lee has something most other aspiring screenwriters from Britain don't have - He has his foot in the door , he has previously written a successful British movie that won awards and made money at the box office and what does he do next ? He gives the audience more of the same <br /><br />Young Jimmy Spud lives on some kitchen sink estate . He is bullied at school and no one loves him . The only thing keeping him going is that he has aspirations to be a ballet dancer . No actually he has aspirations to be an angel but considering his household he may as well be a ballet dancer . He has a macho waster of a father who thinks "" Ballet dancers are a bunch of poofs while his granddad says "" Ballet dancers are as tough as any man you could meet . I remember seeing the Bolshoi ballet ... "" Yup Ballet is a main talking point on a run down British council estate those days - NOT . Come to think of it neither is left wing politics which seems to be the sole preserve of middle class do gooders who live in nice big houses , so right away everything about this set up feels ridiculously false <br /><br />Another major criticism is that this is a film that has no clue who it's trying to appeal to . I have often criticised Channel 4 for broadcasting movies at totally inappropriate times ( THE LAND THAT TIME FORGOT at 6 am for example ) but they showed this at 2 am and for once they've got it spot on . Considering the story involves politics , ballet dancing ( Gawd I hate it ) lung cancer and poverty there's no way this can be deemed suitable for a family audience but since the main protagonist is an 11 year old child and features angels and ballet dancers ( Don't blame me if I seem obsessed with the subject - there was no need to refer to them ) there's not much here for an intelligent adult audience either . <br /><br />Of course if Lee Hall had been told at the script development stage by the producers that he should write a story featuring a schoolboy and an angel and had flatly refused saying that he wanted to write about other themes and stories then I will apologise but throughout the movie you do get the feeling that once the film was completed it was going to be marketed to the exact same audience who enjoyed BILLY ELLIOT"
tt0253335,No Turning Back,"Julia Montejo, Jesus Nebot",2001,98,"Crime,Drama,Thriller","Heavy-handed moralism. Writers using characters as mouthpieces to speak for themselves. Predictable, plodding plot points (say that five times fast). A child's imitation of Britney Spears. This film has all the earmarks of a Lifetime Special reject.<br /><br />I honestly believe that Jesus Nebot and Julia Montejo set out to create a thought-provoking, emotional film on a tough subject, exploring the idea that things are not always black and white, that one who is a criminal by definition is not necessarily a bad human being, and that there can be extenuating circumstances, especially when one puts the well-being of a child first. However, their earnestness ends up being channeled into preachy dialogue and trite situations planted to move the plot along. The decent production values and interesting use of documentary-style camera footage are not enough to accomplish their aim when the script and the acting fall flat.<br /><br />Logic is often compromised for the sake of creating tension: Soid first tries to blackmail Pablo into participating in her documentary in exchange for helping them escape, then in the same breath basically tells him not to trust her because she's not helping them out of altruism. Well, duh. And for a man on the run, Pablo is far too swayed by a temper tantrum. Cristina's well-being is so important to him that he's fleeing capture and jail or deportation for her, but he's willing to risk all that to appease her when she doesn't want to go to Mexico. Right. Talk above over-permissive parenting. Third, when Pablo's employer Charlie gives the phone to Detective Bright, she is remarkably unprofessional, especially given her seniority - did she really think she was persuasive? Oh, yeah, I would have turned myself in. CCH Pounder's Detective Wims could wipe the floor with her.<br /><br />To be fair, I'd like to list the things I liked. Um, I liked the midget. And I liked the fact that the midget was named Sexy. There's cross-dressing, always a plus; juvenile cross-dressing, no less! Harry is infinitely cuter than Cristina. But my favorite moment in the film has to be when Cristina kicks Detective Not-So-Bright. I also find it interesting that, in a heavily minority cast (which I much appreciate, by the way), the black character is the racist one. Too bad it's just thrown out there and not further explored.<br /><br />There's a distinctive, unconventional score, but it's nonetheless generally context-unspecific, not enhancing mood or tension in any scene, except the pathetic, anguished wailing every time the main character is in anguish, as though they think his acting doesn't show it enough: 'Just in case you weren't sure, he's upset, and we have the musical cues to prove it.'<br /><br />Stilted, clichéd dialogue results in a depressing lack of subtext; everything has to be spelled out in dialogue, even when the body language had been up 'til then conveying it just fine. For example, every impassioned speech Pablo makes, and Mrs. Knight's lament that her child won't be crawling into bed with them in the morning.<br /><br />'Papi, tell me about Mama again' - what shameless, blatant exposition introducing the generic dead wife! (She's always the most beautiful woman the widower had ever seen, the kindest he had ever met. Why can't we see a man cry over a woman like Shakespeare's - she may be fat, ugly, obnoxious, but his love for her is deep as oceans? Now _there's_ a story which would move me.)<br /><br />The police always being literally one step behind them gives many scenes the out-of-place feeling of a French farce. Most boring foot chases ever - Bright and Lightning are so out-of-shape and easily-fooled (he certainly isn't quick as lightning, and she, well, I don't feel the need to spell things out). Some guy dragging along a small child outrunning a bicycle cop, complete with macho biker picking a fight but then being felled by a child? To quote Margaret Cho, that's so sad. Would we ever see this on 'Cops '?<br /><br />Hackneyed and over-the-top deus ex machina: as an employer, would you really waive checking his green card just because he can quote the author of the inspirational saying on a poster behind your desk?<br /><br />Plus several scenes, including the above, threaten to devolve into porn: 'Well, I'll do this favor for you, as long as you do something for me...' I can almost hear the bowm-chicka-bowm-bowm.<br /><br />When the parents view the footage shot of Pablo's remorse, the grieving mom's freak-out is the most real the movie feels. Unfortunately, this is diminished by the fact that she looks completely swayed by his emotional speech right up until she goes ballistic. A more ambivalent look would be more convincing here.<br /><br />I'm in constant awe of the stupidity of the main character doing things for the sake of plot: holding up a convenience store without a mask, visiting the dead girl's grave. And why doesn't the mother recognize his face from when she saw him before he drove off?! 'You seem awfully familiar...'<br /><br />What is the purpose of that wholly unnecessary, somewhat gratuitous scene with Soid and the artificially-enhanced bartender? Character development? Tch. Too little, too late.<br /><br />Speaking of unnecessary traits that never went anywhere, Detective Lightning's saying skeptical Detective Bright must be a Scorpio shows how little he really knows about the occult. And I don't think that believing in fate quite qualifies as voodoo mumbo jumbo.<br /><br />At the end, when Bright holds Pablo as he dies - wait, why does she care now? Her character is as inconsistent as Soid's. What, she has to shoot him just because she said 'Stop, or I'll shoot'? (She's cared _so_much_ about her integrity thus far.) He was unarmed. There was no need for lethal force. What's wrong with shooting him in the leg to immobilize him?<br /><br />Finally, Cristina's childlike acceptance of her mother's death giving Dr. Knight peace over his daughter's death - so forced. And the contrivance of the family whose child was killed becoming Cristina's new family... It angers me that she could be a 'replacement' for their little girl. It's also unrealistic that a white couple would take in the Latino daughter of the man who killed their own daughter. I'm not saying there aren't generous, loving people who would do that. I'm just saying that the characters here are never developed far enough for me to believe that _they_ would do that.<br /><br />I find it offensive that another IMDb reviewer said that of course as a woman she was moved by the sappy scenes. I am a woman who reserves my emotional movements for moments that don't wax sentimental in a manufactured manner.<br /><br />Co-writer, co-director, co-star Nebot said himself he wore too many hats during this production. Too many cooks may spoil the broth, but one cook alone just might end up making an after-school special.<br /><br />In conclusion, this film's title has less to do with the story and more to do with the feeling of regret, helplessness, and loss accompanying the revelation that you will never see your money again."
tt0257106,Scary Movie 2,Keenen Ivory Wayans,2001,83,"Comedy,Horror","I *loved* the original Scary Movie. I'm a huge fan of parody- it is my favorite form of humor. It is sometimes regarded as the most intelligent form of humor. The Wayans boys seemed to grasp that concept perfectly in the original film, then temporarily forgot it when making the sequel. I think the Wayans' are a family of comical geniuses. Alas, even geniuses make mistakes.<br /><br />The movie begins with promise. I liked ""The Exorcist"" parody, especially the ""come on out, ma"" gag. Now, that's Wayans-quality material. But, other than that, I can only think of two other times I laughed: 1) when Tori Spelling is seduced in the middle of the night by a spirit, then becomes clingy and starts talking about marriage with him. Meanwhile, he's saying, ""It was just a booty call!!"" That was kinda funny. 2) The ""Save the Last Dance"" parody where the Cindy character inadvertently beats up a girl while practicing her new moves. But even the short-lived giggles are no match for the side-splitting laughs of the first Scary Movie.<br /><br />The rest of the movie is pure trash, filled with cheap gross-out gags. Jokes from the first movie which were subtle or implied are magnified and overdone. For example, in Scary Movie I, several innuendos are made to imply that the character Ray is gay. This was hilarious. But, in Scary Movie II, the whole penis-strangulation scene with Ray under the bed was mind-numbing and incredibly unfunny. This is the pattern of the whole film. Shock humor *alone* doesn't take a movie very far. This was a trend in 2000 and 2001, unfortunately. <br /><br />As much as it pains me to rate a Wayans movie so low, I have to give this one a 2 out of 10."
tt0272069,Demonicus,Jay Woelfel,2001,72,Horror,"Seriously. I just wrapped up my first viewing of Demonicus and words have failed me.<br /><br />I remember a time when I would see Charles Band's name on a film and my heart would race. He was never a Wes Craven or a John Carpenter. He was a bastion of hope for the little man. The guy whose movies arrived at the video store instead of the multiplex, but they still rocked harder than most of the trendy junk we otherwise had to endure.<br /><br />And now... this.<br /><br />A painfully-obvious Californian walking trail doubles for ""the Alps"" and an abandoned train tunnel is actually supposed to be ""an ancient cave"". I mean, they didn't even try to dress the thing up with moss or film it in a way that might suggest it was anything other than an old train tunnel! Ugh! Instead of a creepy demon gladiator, as the cover implies, we're treated to a dude wearing the latest in Wal-Mart Halloween apparel. There's a pretty cool looking corpse, who occasionally comes to life to belch and wiggle his fingers, but he doesn't even learn to stand until the final five minutes. Why couldn't he be the villain? Instead, we've got frat boy Joe with a plastic sword. Ouch.<br /><br />Charles Band... you should be ashamed that your name is attached to such tripe. I love movies that are so bad, they're good. Hell, I occasionally enjoy a flick thats so bad, its just bad. This one, however, is just unwatchable. A perfect example of making a buck, rather than making a quality film."
tt0275067,Wendigo,Larry Fessenden,2001,91,"Horror,Mystery,Thriller","This movie is S-L-O-W. Spent most of the movie actually waiting for it to 'begin'.<br /><br />The setting was bleak, the script was bleak, the cinematography was bleak, the plot was bleak, the budget was low (not that all low budget movies are bad, but this one had no redeeming features).<br /><br />The plot was more consumed with a vengeful, slightly deranged hunter than the actual Wendigo which made a very brief appearance toward the end of the movie. This in itself was disappointing as this 'Wendigo' was just a bizarre mix of a tree and a stag. Everything about the movie was uninspiring.<br /><br />The parents of the little boy appeared to be rather aloof and at times seemed completely detached from their son. Whether this was down to bad acting or a bad script I'm not sure, but it only heightened my disappointment and boredom levels.<br /><br />There was no food for thought, nothing to pique an interest. With no real intrigue or chill factor, this movie creaked along so painfully, you just couldn't care less what happened by the end.<br /><br />Wendigo's ambiance reminds me of the dull movie shown at the awards ceremony toward the end of 'Mr Bean's Holiday': a movie which is artistic and nonsensical, trying too hard to to be deep and meaningful, but coming across as pretentious and boring.<br /><br />I would never want to watch this again. I only watched it to the end in the vain hope that something interesting might happen ... but it didn't."
