movie_id,title,director,year,runtime,genres,review
tt0038514,The Face of Marble,William Beaudine,1946,72,"Horror,Sci-Fi","A scientist (John Carradine--sadly) finds out how to bring the dead back to life. However they come back with faces of marble. Eventually this all leads to disaster.<br /><br />Boring, totally predictable 1940s outing. This scared me silly when I was a kid but just bores me now. I had to struggle to stay awake! With one exception, the acting is horrible. Such expressionless boring actors! Hopeless.<br /><br />There are some good things about this: Carradine, despite the script, actually gives a very good performance. And there are a few mildly creepy moments involving a ghost of a Great Dane walking through walls. There's also one of the worst-looking knockouts in cinema history. Still, none of this is fun enough to sit through this. Avoid."
tt0045064,Radar Men from the Moon,Fred C. Brannon,1952,167,"Action,Family,Sci-Fi","This serial is interesting to watch as an MST3K feature, but for todays audience that's all it is. I was really surprised to see the year it was made as 1952. Considering that fact alone makes this a solid (lowly?) 2 in my book. The cars used don't even look contemporary, they look like stuff from the 30's. It's basically Cody (the lone world's salvation? Sheesh talk about an insult to everyone else, like the military), anyway it's Cody in his nipple ring flying suit against Graber and Daley two dumb*ss henchman who sport handguns and an occasional ray gun thats pretty lame in its own right, enjoy. If you want to watch a really good serial see Flash Gordan, it's full of rockets that attack each other and a good evil nemesis and also good looking women, this has NONE of that. And Flash was made 15 or so years before this crap so you can give it some slack. Something made in 1952, this bad, deserves a 2. Nuff said. give it a 6 if your watching it as a MST3K episode, those guys have some good fun with it; a tweak of the nipples here, a tweak there and I'm flying! And now as an added bonus, I bring you the Commander Cody Theme song as originally sung by Joel and his two character bots Tom Servo and Crow aboard the satellite of love for episode eight The Enemy Planet:<br /><br />(Singing at the very beginning credits);<br /><br />(TOM SERVO SINGING) YOUR WATCHING COMMANDER CODY.... HE IS THE NEW CHARACTER FROM REPUBLIC,<br /><br />HE GETS IN TROUBLE EVERY WEEK... BUT HE'S SAVED BY EDITING,<br /><br />JUST A TWEAK OF HIS NIPPLES... SENDS HIM ON HIS WAY,<br /><br />A PUMPKIN HEAD AND A ROCKET PACK.... WILL SAVE THE DAY,<br /><br />(JOEL SINGING) HIS LABRATORY IS A BOXING RING... WHEN BAD GUYS COME TO MIX IT UP,<br /><br />SOMEBODY ALWAYS GETS KIDNAPPED... AND CODY HAS TO FIX IT UP,<br /><br />HE DRINKS HIS TEA AT AL'S CAFE... AND FLIES ALONG ON WIRES,<br /><br />HE BEATS THE CROOKS AND FLIES WITH HOOKS... AND PUTS OUT FOREST FIRES,<br /><br />(CROW SINGING)<br /><br />BAD GUYS BEWARE... CODY IS THERE,<br /><br />YOU'LL LIKE HIS HAIR IT'S UNDER HIS HELMUT... AND BECAUSE WE CAN'T THINK OF A GOOD RHYME,<br /><br />THAT'S THE END OF THE COMMANDER CODY THEME SONG... SO SIT RIGHT BACK WITH A WILL OF GRANITE,<br /><br />AND WATCH CHAPTER EIGHT, CAUSE THAT'S THE ENEMY PLANET"
tt0049223,Forbidden Planet,Fred M. Wilcox,1956,98,"Adventure,Sci-Fi","I liked how this started out, featuring some decent special-effects especially for a film 50 years old. There was some pretty impressive scenery. However, the film bogs down fairly early on with some very dumb dialog as the males all try to flirt with Anne Francis ""Altaira Morbius."")<br /><br />Viewing this in the '90s after a long absence, it was fun to see Francis again, an actress who has done mostly television shows since this film was released....and is still acting. It also was interesting to see a young-looking Leslie Nielsen (""Dr. John J. Adams""), who I wouldn't have recognized had it not been for this voice <br /><br />I watched half of this movie before the boredom came almost overwhelming and I had a strong desire to go to sleep. I appreciated them re-doing this VHS tape in stereo. but it was a weak effort. This is one those overrated film where ""elites"" think is so ""heavy"" and ""thought-provoking."" That's nonsense. It only appeared ""intelligent"" because the rest of the '50s sci-fi films were so stupid!!<br /><br />Some if the early scenes would have looked great on wideescreen, which I didn't have at the time of this writing. Perhaps another look - this time on the 2.35:1 widescreen transfer would make me change this review."
tt0062159,The Projected Man,"Ian Curteis, John Croydon",1966,77,"Horror,Sci-Fi","I remember this film, exhibit in Barcelona (Spain) in 1970, for the time of a week. Although it could seems incredible, and I can't offer any explanation for it, this movie was exhibit in a theater dedicated to... movies of art and big quality (that, is, Bergman, Resnais, Malle, Buñuel, and... The Projected Man). Few people saw it (luckly people, no doubt) and no reference about this very boring SF movie can be found in the Peter Nichols Science Fiction Encyclopidie, or about the author of the original novel. Very indicative. I remember of it, after all this years, a no-story, a lot of special effects that seems ridiculous effects in fact, and no more. It seems that in some countries the running time is 90 mm. and in anothers 77 min. Well, it means only a little more of pain."
tt0065738,Frankenstein Must Be Destroyed,Terence Fisher,1969,101,"Drama,Horror,Sci-Fi","I loved ""The Curse of Frankenstein"" so much that I rushed out to get ""Frankenstein Must Be Destroyed"" to see Cushing at it again...even if it was without Chistopher Lee this time. To my great disappointment, this movie not only does without Lee, but it does without Frankenstein's Monster altogether! Was it a case of ""If we can't get Lee, we won't have a monster at all""? Why would they do that? The monster is half the fun of the whole thing!! This film is dedicated solely to the study of Baron Frankenstein and his quest to finish experiments he had begun in brain transplants before ending up in an asylum. I found the script extremely weak, with the need to suspend disbelief forced upon the audience a little too much. I'm willing to suspend a fair amount, but this movie got fairly ridiculous, which took me out of the film rather than immersing me in it.<br /><br />Peter Cushing, though, is absolutely brilliant playing pure evil in this film. For being one of the most beloved actors and notoriously sweet men, he sure could play menacing and malevolent extremely well. The supporting cast is competent, but has little to do, even the young doctor and his fiancée blackmailed into helping Frankenstein. A bumbling police chief is introduced, along with his put-upon sidekick, to generate some comic relief, then they are completely dropped from the movie! Why? We are led to believe that the police chief will be the main nemesis of the Baron, then we are led to believe it will be the young doctor, and then it ends up being the victim of Frankenstein's brain transplant experiment. There was no tension, we weren't invested in the ""creature"", and the ending was left so ambiguous as to leave one unsatisfied because it is so clear they are setting up another sequel.<br /><br />Also, there are virtually no ""horror"" elements. Yes, there is a beheading in the beginning (off-camera), and we are treated to the sounds of Cushing cutting the tops of two men's skulls off (again, off camera), and there is the most unsettling and thoroughly unnecessary rape scene (90% of which is, again, off-camera). I understand that there is a love of ""letting the audience imagine it all, for their imaginations are far worse than what we can show"", but come on, if you're not going to give us a Monster, then at least let us SEE the few ""horrific"" elements you do choose to include. Showing us a skeleton in the lab lit with a green light is just not scary.<br /><br />On top of a weak script, I thought the directing was mostly flat. There were a couple of nice shots, but otherwise no excitement, atmosphere, or suspense was generated. The same director did ""Curse"" back in 1958 and I thought it was brilliantly directed...guess he was as uninspired by this film as I was.<br /><br />The movie gets a 4 out of 10 from me strictly for Peter Cushing's powerful, nuanced performance...beyond that, I found little in this movie worth recommending. Instead, my suggestion is to watch ""The Curse of Frankenstein"" and see a truly great Hammer horror film."
tt0075781,The Brain Machine,Joy N. Houck Jr.,1972,85,"Sci-Fi,Thriller","I bought this (it was only $3, ok?) under the title ""Grey Matter"". The novelty of seeing Sherriff Roscoe in a non-DukesOfHazzard role intrigued me. As the other reviewers warned, it's a pretty boring tale of a top secret government experiment gone awry.<br /><br />And yes, there are plenty of establishing shots, especially of a house with a pool in front of it. Some of the characters and interiors are so nondescript I guess the filmmakers worried we might forget who is who, so they keep tipping us off by first showing the outside of the buildings. It's actually kinda funny. After awhile the pool shot feels like a tv channel's station identification logo, reminding us that we are watching ""Grey Matter"".<br /><br />I also enjoyed two bouts of name-calling. At one point an angry test subject taunts somebody in charge by calling her a ""Scientific b*tch!"". It's just a very inadequate insult. Several scenes later a different subject lets off steam by muttering about that ""scientific b**tard!"". It just sounded very awkward to me.<br /><br />Someday this movie will disappear forever. Another decade from now it will likely be impossible to find any copies of it. Almost like it never happened.<br /><br />"
tt0075990,End of the World,John Hayes,1977,86,"Horror,Mystery,Sci-Fi","A good deal of running around. A badly conceived adversary with very little complexity. A scientist who works in communications sending off signals into space and receiving them, gets caught up with aliens. Along with his pretty wife, he invades their territory and is given secrets about them. He becomes rather traitorous in the process. Granted, he is given little choice anyway. There is a scene where he gives them everything they want. This is a dull movie with lots of long stretches where little happens. The plot isn't technically bad. It's just that we are usually following a car, a trip through a woods, investigating a building. This is what editing is all about. I suppose the story wouldn't technically support much more. Not much here."
tt0082642,The Last Chase,Martyn Burke,1981,101,"Action,Adventure,Sci-Fi","After watching this on the MST3K episode, I have to wonder how many movies this film borrows from. It seems to combine elements of Logans Run, Farenheight 451, Final Sacrifice and at least several others. At one point I was really expecting Cris Makepease to call Lee Majors ROWSDOWER. <br /><br />I wonder if the director has any clue how many holes there are in the plot. like the fact that, even though gas is unavailable, there is plenty of it in abandoned gas stations, and the stations are located close enough together to keep an F1 race car going all the way across the country."
tt0083050,G.I. Samurai,Kôsei Saitô,1979,85,"Action,Adventure,Sci-Fi","I'm sorry but this is just awful. I have told people about this film and some of the bad acting that is in it and they almost don't believe me. There is nothing wrong with the idea, modern day Japanese troops get pulled back in time to the days of Busido warriors and with their modern weapons are a match for almost everything. When the troops first realise something strange is happening does every single person in the back of the transport need to say ""Hey my watch has stopped""? Imagine lines like that being repeated 15+ times before they say anything else and you have the movie's lack of greatness in a nutshell."
tt0086967,Biohazard,Fred Olen Ray,1985,84,"Horror,Sci-Fi","I was always curious about this film because it is so tough to find, so when I stumbled upon it on Ebay I forked over the $10 and bought it, now I understand why its so rare! This film is SO bad, so terribly written and hopelessly low budget that the ending credits, which show all of the cut scenes where they fumbled their lines, are literally the movie's highlight. The film is about a psychic (Pettyjohn, cast for one obvious reason, her topless scene) whom uses her powers with an experimental machine to pull objects from another dimension into this reality. When she pulls in some kind of box like object the military nonchalantly throws it into the open back of a truck with one soldier to guard it, and gee, what do you know? SURPRISE! A kid in a foam-rubber monster costume pops out, instantly kills the soldier with a scratch across his face, then escapes to a nearby city. But rather than deploy half the armed forces of the county to find it and protect the public those in charge just leave it up to Pettyjohn and Ray to find it on their own, but no matter, this movie blows all its credibility LONG before then. This barely escapes being voted a 1 by me only because of unintentional laughs, somebody needs to alert the producers of ""Mystery Science Theater 3000"" if they don't know about it already! 2 out 10, really, REALLY bad!"
tt0087799,Night of the Comet,Thom Eberhardt,1984,95,"Comedy,Horror,Sci-Fi","This movie was bad. This movie was horrible. The acting was bad. The setting was unrealistic. The story was absurd: A comet that appears once in eons is set to appear one night. Most of the world's population decided to watch this comet. Then, the next morning everyone but a select few of people has been turned to dust from the comet's radiation. People's clothes are still intact, there are plants which are still alive, but the people were turned to dust. No bones, nothing. Thats ridiculous. How can radiation incinerate people but leave their clothes and other biological substances intact?<br /><br />Even better, the comet mutated some people into zombie flesh eating monsters. Their makeup would not have even looked frightening to a newborn child. The Insane Clown Posse scare me more...and they're supposed to look stupid.<br /><br />Then there were the survivors. People who had been surrounded by steel when the comet passed were spared from zombie-dom and death. How can steel block a comet's radiation that supposedly incinerates people in their tracks?<br /><br />Equally insulting is the 60's horror music playing in the background through parts of the movie, or the 80's hair rock which serves no purpose in the film and makes you want to shoot your television.<br /><br />The stupidest part of the movie, however, are the characters it focuses on: two Valley Girls and Chakotay from Star Trek: Voyager. These three characters were totally unrealistic. Who would go looting the day after an apocalypse with flesh eating mutants running everywhere? There were four 5 minute horror scenes in the entire movie, and most of them were dreams. In between these scenes is unsophisticated dialog which makes South Park seem intelligent. The silence in between the elementary dialog was painful. I could have made a better movie with four monkeys and a bag of Cheetos. Don't see this movie, ever."
tt0089280,Hobgoblins,Rick Sloane,1988,88,"Comedy,Horror,Sci-Fi","For starters, ""Hobgoblins"" tries to ape the more successful ""Gremlins"". That's bad enough but they don't even try to make anything that closely resembles a movie here. Instead, it's more like a bargain basement, everything-must-go clearance of embarrassing scenes, inappropriate sound FX, acting as bland as unflavored tapioca and a script that takes everything humans hold sacred in their motion pictures and throws 'em down the old tube-aroo.<br /><br />The plot? Grrrr.... Meddling kids track down gremlin-like creatures from movie lot before they kill people by projecting their fantasies. Sound cool, does it? Well, see that wall on the other side of your room? Run right at it, top speed, face first. See, THAT is cooler than this movie.<br /><br />You dare to doubt? Quick, name something else one of the leads has been in other than this. What other scripts have the writers done since ""Hobgoblins""? Name another Rick Sloane directoral effort. How many ""Hobgoblins"" action figures do you have? See? THANK you.<br /><br />I cannot believe I took so long to write about such a horrible film. I'd rather write about more important things; like the separation of church and state, economic restructuring in Europe, that kind of thing. But no, ""Hobgoblins"" it is and it is bad - bad like your grandparents' wallpaper, bad as pink flamingos on your lawn, bad like underwear that says ""Home of the Whopper""...and I think we'll stop there.<br /><br />Well, Mike and the robots fight valiantly but try as they might, they can do only so much with ""Hobgoblins"" before they realize that, yes, the director DOES need kicked in the shin.<br /><br />Real, real hard.<br /><br />One star for ""Hobgoblins"", seven stars for the MST3K version."
tt0090849,Class of Nuke 'Em High,"Richard W. Haines, Lloyd Kaufman",1986,85,"Comedy,Horror,Sci-Fi","It looks to me as if the creators of ""The Class Of Nuke 'Em High"" wanted it to become a ""cult"" film, but it ends up as any old high school B-movie, only tackier. The satire feels totally overshadowed by the extremely steretyped characters. It's very un-funny, even for a turkey."
tt0093741,The Pink Chiquitas,Tony Currie,1986,83,"Comedy,Horror,Sci-Fi","Sly Stallone is hardly the finest actor in the world but compared to his brother, Frank...well, roll out those awards now! Mullet haired, muppet Frank seems to think that every part he plays, calls for him doing the role as an American/Italian Wise-guy refugee from the 'Godfather.' Please, somebody make him an acting offer 'he can refuse!' This film just stinks the place out, even by the terrible overacting in this, Frank still steals the acting dishonours. All the people compensate for their lack of talent by shouting their lines and throwing their arms about, gesticulating wildly in a style that went out of fashion back with silent films.<br /><br />The plot, what there, is, makes no sense as a meteor lands and turns all the women into sex-crazed nymphets but as this is 15 certificate film, that just means they strip to their underwear and make moaning sounds like dogs on heat. What happens in the end, I'm not quite sure as I was losing the will to live long before the film finished.<br /><br />Avoid this like the plague and watch 'Deep Impact' for a reasonable film about a meteor about to hit the earth.<br /><br />N.B. Point of order: when one of the female leads strips down to her underwear, she has her knickers/panties under her suspenders/garter belt, it's knickers over the suspenders to allow women to go to the toilet with less fuss. A trivial point, perhaps, but shows how dumb this film is when they can't even get this right!"
tt0095043,Doctor Hackenstein,Richard Clark,1988,88,"Comedy,Horror,Sci-Fi","This movie features an o.k. score and a not bad performance by David Muir as Dr. Hackenstein. The beginning and end credits show along with the most of the actors and the ""special effects"" that this is a low budget movie. There is nothing in this movie that you could not find in other mad scientist, horror/comedy, or low budget movies. Not special for any nude scene buffs or bad movie lovers either. This movie is simply here. Anne Ramsey and Phillis Diller are nothing to get excited about as well. If you are curious as I was and can actually find this, you will realize the truth of the one line summary."
tt0097630,Journey to the Center of the Earth,"Rusty Lemorande, Albert Pyun",1988,100,"Adventure,Sci-Fi","Journey to the Center of the Earth is the story of some tourists of Hawaii, three of them siblings, and one of them a young British nanny babysitting a dog. When the siblings accidentally drive off in their jeep with the basket of dog biscuits, the nanny follows them (it might've just been safer to purchase more) all the way to the cave the siblings intended to explore (I guess). For some reason, they actually go in the cave and then, when the place starts caving in, they try to get out to no avail, except for the six-year-old sister who they tell to go get help. Meanwhile, the more they move around in the cave, the more they continue to plummet further and further towards the earths cavernous core. And behold, it is here where they find the City of Atlantis and its bizarre alien habitants who are living under the oppressive rule of one alien that doesn't want them asking to many questions about the worlds external to their own.<br /><br />I see that Rusty Lemorande, the named director of the film has provided comments on this film, in which he explains that part of latter half of this film is actually the sequel to Alien in L.A. Well, whatever it was, it was an amazingly cheap movie that I would rank only slightly higher than City Limits (a 1988 sci-fi film also made on a non-existent budget) because at the least ending of this dreadful piece of mostly incoherent film-making that cuts corners where it can aims for some humor and amusement in the last 20 minutes when we finally see what life is like in the alien world at the center of the Earth. I also give it a two star rating rather than one because it was at times, funny, even if only in its subtleties. For example, the aliens asks the British girl if she's an alien and she explains that the Ministry should be sending her work visa shortly. Or when the alien girl finds Bryan and explains that he is in the city of Altantis and he mistakes this for Atlantic City, New Jersey. Little things like that make the idiocy of the first hour or so tolerable. Imagine how great the film could've been though if they had 1) actually intended to make it, and 2) actually had money to make it.<br /><br />I do like how in the end, no one wonders what happened to the little sister who was sent away in the beginning to get help. She'd just be wandering around the Hawaiian caves and not too far from the erupting volcano, mind you."
tt0097874,Metamorphosis,George Eastman,1990,96,"Horror,Sci-Fi","As others have mentioned, this movie is similar to THE FLY (both versions) and the lesser known sci-fi flick ALTERED STATES. The big difference is that those two movies were well made by people who knew what they were doing and were good at it. METAMORPHOSIS did not have these advantages. METAMORPHOSIS is a potentially interesting science fantasy story that had the wrong people in charge of it and the wrong actors playing the roles.<br /><br />The story follows scientist Dr. Peter Houseman (Gene LeBrock), an obsessed man working on a genetic cure to aging and death. When the university he works for threatens to cut funding, he decides to inject the anti-aging serum into himself. As a result, Dr. Houseman spends the rest of the movie slowly turning into a lizard. And oh yes, watching the good doctor go through the process of becoming that lizard is a great joy. It really is so bad that it's good. Some of the lines are classic: ""What WAS it?"" ""A nightmare...from the past!""<br /><br />Many of the reviews that I've read for this point up how stupid and ridiculous the last five minutes of this movie are. I'm just going to go ahead and spoil it: the good doctor goes from being a shuffling half-man, half-lizard thing to being what appears to be a man in a rejected Godzilla costume, when the police finally gun him down. In the final scene, some obnoxious kid is seen with a little pet lizard which he claims will never die, and the movie's heroine, Sally Donnelly (Catherine Baranov) evidently decides that the little lizard is the final incarnation of Dr. Houseman. The camera then gives us a close-up of the lizard's face; this is, I assume, the director's way of showing us that the lizard is EVIL. Yes, it is goofy, but I fell over laughing so I can't complain.<br /><br />I watched this movie because it was a part of the Chilling Classics 50 Movie Megapack that I purchased. I'm sure many of those who are reading this did exactly the same thing, as the 50 pack is the only way to see this movie on DVD. If you have recently bought the boxed set and haven't watched this movie yet, it really is worth your time, even if I did just ruin the ending for you. It might also be possible to find this movie online for free."
tt0098375,Spontaneous Combustion,Tobe Hooper,1989,97,"Horror,Sci-Fi,Thriller",how can a director that makes such great films as poltergeist and the texas chainsaw massacre make such rubbish as this? i got this film off a friend and he didnt want it back its so bad. how this can be classed as horror i will never know.<br /><br />2/10
