movie_id,title,year,runtime,director,genres,review_summary
tt0070795,A Thief in the Night,1972,69,Donald W. Thompson,"Drama,Fantasy,Horror","The reviewer appreciates ""Oppenheimer"" for its biblical accuracy in portraying profound truths about life choices; as a Christian deeply moved by personal faith decisions rather than just entertainment value or scares."
tt0024727,The Vampire Bat,1933,65,Frank R. Strayer,"Drama,Horror,Mystery",A highly recommended suspenseful horror classic set in a Bavarian village with memorable performances; minor concern about missing scenes due to shorter print lengths.
tt0303397,Soft for Digging,2001,74,J.T. Petty,"Drama,Horror,Thriller","The reviewer highly praises an atmospheric horror film created with minimal budget as excellent. They recommend seeing this unique gem, especially for fans who enjoy genre movies that are both creepy yet compelling without traditional trailers available on mainstream sites like IMDb."
tt0115834,Carnosaur 3: Primal Species,1996,80,Jonathan Winfrey,"Action,Horror,Sci-Fi",Primal Species offers poor acting with an outdated dinosaur portrayal; its short runtime makes for minimal entertainment value.
tt0082745,Midnight Offerings,1981,100,Rod Holcomb,Horror,MIDNIGHT OFFERINGS disappoints despite its serious tone; disappointing plot and minimal witch magic overshadow Melissa Sue Anderson's decent acting.
tt0033660,The Ghost Train,1941,85,Walter Forde,"Comedy,Horror","A British comedy-thriller remake updates Will Hay's plot for wartime conditions; Arthur Askey shines despite an initially irritating personality. Notable atmospheric scenes during one stormy night create gripping tension, especially in later half-hour with mysterious couple and title vehicle arrival. Kathleen Harrison as the stereotypical frightened spinster adds humor amidst excitement to take first drink."
