movie_id,title,year,runtime,director,genres,review_summary
tt0239625,Mermaid,2000,94,Peter Masterson,"Drama,Family","The reviewer praises ""Mermaid"" for its heartfelt message and impressive cast featuring Ellen Burstyn as a double Emmy-nominated actress alongside Samantha Mathis; Jodelle Ferland, who won an award in 2001, adds notable talent to the film directed by Peter Masterson."
tt0190524,Left Behind: The Movie,2000,96,Vic Sarin,"Action,Drama,Fantasy","The reviewer criticizes both movies in terms of writing quality but praises production value; they find it problematic to adapt a R-rated Christian novel into G-rated films without compromising on character development, themes, and theology."
tt0194218,Panic,2000,88,Henry Bromell,"Comedy,Crime,Drama","""Panic"" offers a captivating exploration of complex relationships amidst moral ambiguities; its open-ended narrative provokes mixed reactions due to compelling character development."
tt0976026,Cheeni Kum,2007,140,R Balki,"Comedy,Drama,Romance",A refreshing first-half romance between Amitabh Bachchan's character (64) and Tabu’s portrays their dynamic well in R Balki's debut but suffers from an uninspired second half with a disappointing subplot; overall enjoyable despite being less than stellar.
tt0411008,Lost,2004,45,"Jack Bender, Stephen Williams, Paul A. Edwards, Tucker Gates, Eric Laneuville, Greg Yaitanes, Bobby Roth, Kevin Hooks, J.J. Abrams, Daniel Attias, Rod Holcomb, Karen Gaviola, Stephen Semel, Marita Grabiak, Michael Zinberg, Adam Davidson, David Grossman, Robert Mandel, Alan Taylor, Matt Earl Beesley, Roxann Dawson, Deran Sarafian, Paris Barclay, Frederick E.O. Toye, Mark Goldman, Mario Van Peebles","Adventure,Drama,Fantasy","The reviewer enjoys season 1's diverse characters on an island full of secrets; they praise its unexpected twists resembling X-Files mixed with Melrose Place, highlighting excellent acting despite bizarre storylines."
tt0765447,Evening,2007,117,Lajos Koltai,"Drama,Romance",The Provincetown Film Festival showcases an emotionally impactful drama with stellar performances by Vanessa Redgrave as the matriarchal protagonist opposite Claire Danes's younger self; despite predictable family themes it offers beautiful cinematography and nostalgia-evoking cars.
tt0346293,Hitler: The Rise of Evil,2003,93,Christian Duguay,"Biography,Drama,History","A German reviewer criticizes Robert Carlyle's portrayal as Hitler in an inaccurate film, while praising ""Der Untergang"" (""The Dawnfall"") directed by Oliver Hirschbiegel. They emphasize that real historical accounts should not be misrepresented and encourage viewers to watch this better-presented depiction of Nazi Germany’s final days online."
tt0286499,Bend It Like Beckham,2002,112,Gurinder Chadha,"Comedy,Drama,Romance",The reviewer finds a seemingly uplifting film sad due to personal loss of potential in sports; despite its feel-good intent about dreams overcoming traditions. The poignant struggle with family expectations resonates deeply for former athletes.
tt0311289,Holes,2003,117,Andrew Davis,"Adventure,Comedy,Drama","The reviewer initially found ""Unforgiven"" slow but ultimately enjoyed its satisfying plot twist; Jon Voight's casting impressed them despite some tedious parts at the start (Rating: 8/10)."
tt0382330,As It Is in Heaven,2004,133,Kay Pollak,"Comedy,Drama,Music","The reviewer admires 'As It Is In Heaven' for effectively conveying a profound message about listening as life's secret and praises it, despite its predictable drama; artistry unfolds through characters embracing an enlightened approach."
