movie_id,title,year,runtime,director,genres,review_summary
tt0046807,Brigadoon,1954,108,Vincente Minnelli,"Fantasy,Musical,Romance","A reviewer criticizes ""Brigadoon"" as overly phony, cheesy with weak dialogue and plot while appreciating its unique portrayal influenced by psychedelic effects; recommends for musical enthusiasts only."
tt0061834,I Am Curious (Yellow),1967,121,Vilgot Sjöman,"Drama,Romance","The reviewer dismisses ""I Am Curious: Yellow"" as pretentious and nonsensical, criticizing its portrayal (or lack thereof) of female genitalia compared to male nudity in other films. They argue there's no double standard but a cultural discomfort around depicting women’s private parts outside explicit content."
tt0121113,Black Bart,1975,25,Robert Butler,"Comedy,Crime,Western","A harsh critique emphasizing its unfunny nature, laugh-track reliance for humor context, Louis Gossett Jr.'s earnest but cringe-worthy performance as Cleavon Little compared to better work in El Diablo. The only redeeming feature: Barney Fife's amusingly memorable equine partner."
tt0075265,A Star Is Born,1976,139,Frank Pierson,"Drama,Music,Romance",The reviewer enjoys Judy Garland’s '76 version for its realism over her classic portrayal in both versions but laments that it lacks recognition despite superior quality.
tt0068235,Au Pair Girls,1972,86,Val Guest,"Comedy,Romance","A fun and innocently toned movie with significant nudity evolving from comical situations; highlights Gabrielle Drake’s striking performances both nude and in costume. The reviewer loves Rick O'Sullivan's character transformation to 'Randi' (sic) and expresses admiration for the film's origins related to softcore features, particularly praising Blake Emmett alongside Gabby Drake who maintains her stunning beauty regardless of attire."
tt0026110,Betty Boop with Henry the Funniest Living American,1935,7,"Dave Fleischer, Myron Waldman","Animation,Comedy,Family",Review expresses disappointment with uninspired humor; criticizes character negligence and short runtime.
tt0027657,The Garden of Allah,1936,79,Richard Boleslawski,"Adventure,Drama,Mystery","A visually stunning yet narratively shallow 1930s film starring Marlene Dietrich, lauded more for its gorgeous cinematography than story content; missed opportunity with John Gilbert's untested replacement."
