movie_id,title,year,runtime,director,genres,review_summary
tt0909291,Justice,2007,42,Steven S. DeKnight,"Action,Adventure,Drama","The reviewer highly praises this 6th season episode for introducing five new heroes to form a Justice League, highlighting Chloe’s excellent inclusion in their dynamic team; they award it with an impressive rating of ten and note Lex's secret labs as his downfall. Title: ""Justiça"" (""Justice"") (Brazil) Reviewer's Rating: Ten"
tt0454440,Distortion,2005,103,Haim Bouzaglo,Drama,A layered drama about betrayal intertwines personal life events on stage amidst actual backstage chaos; recommended for its engaging narrative despite predictable outcomes.
tt0244981,At Any Cost,2000,89,Charles Winkler,Drama,"The reviewer finds Beyond Gravity enjoyable despite its VH1 production roots; standout performance by Glenn Quinn as an ""evil"" friend merits watching this film featuring familiar soft rock/pop themes wrapped in a somewhat predictable L.A. band success story."
tt0228979,Two of Us,2000,89,Michael Lindsay-Hogg,"Biography,Drama,Music","The reviewer enjoyed ""VH1 Storytellers: The Beatles"" as it captured their authentic bond; although hampered by exaggerated accents and missed potential SNL performances."
tt0962736,The Young Victoria,2009,105,Jean-Marc Vallée,"Biography,Drama,History",The reviewer praises Emily Blunt's standout performance as young Victoria but feels disappointed by an abrupt ending; they commend outstanding production quality for its portrayal of Victorian-era Britain. Highly recommended for those captivated by history or romantic narratives.
tt0499537,Offside,2006,93,Jafar Panahi,"Comedy,Drama,Sport",The reviewer appreciates Panahi's nuanced portrayal of diverse Iranian personalities and finds its subtle cultural contrasts captivating while noting how such films could combat racism by fostering individuality recognition.
tt0459744,Blood Gets in Your Eyes,2005,119,Yōjirō Takita,"Action,Drama,Fantasy","The reviewer enjoyed Ashura's unique kick-off at Fantasia Festival 2005 and praised its original plot about demons in Edo. They particularly liked Izumo as an all-around hero who skillfully blends fighting prowess with wit while appreciating the film's manga-like cinematography full of special effects, deeming it a must-see masterpiece despite some elements being straightforward."
tt0765447,Evening,2007,117,Lajos Koltai,"Drama,Romance","The movie excels in period detail, acting quality by Vanessa Redgrave and Claire Danes but falters with its inconsistent plot disrupted by poorly integrated characters like Lila's brother Buddy and the unconvincing romance between young Ann and Harris."
tt0831840,Ahista Ahista,2006,122,Shivam Nair,"Drama,Romance","Abhay Deol's new film about Dheeraj rescuing Megha from multiple situations echoes Dostoyevsky but feels more realistic than Saawariya, despite its weak music score; Abhay shines as the witness in an otherwise good cast performance."
tt0482102,Sorrows Lost,2005,15,Brian A. Metcalf,"Drama,Fantasy,Horror","""Sorrow Lost"" is an unforgettable, beautifully shot short film notable for Eric Etebari's exceptional acting as he plays both father figure and demon to young girl protagonist; despite minor pacing issues at the start, its stunning cinematography left a lasting impression on viewers."
