movie_id,title,year,runtime,director,genres,review_summary
tt0425818,Cero y van 4,2004,92,"Carlos Carrera, Alejandro Gamboa, Fernando Sariñana, Antonio Serrano","Comedy,Crime","The reviewer highly praises ""Cero y Van Four"" for its shocking portrayal of urban violence in Mexico with stunning visuals and strong narrative twists; however, it may not resonate as much without French subtitles compared to Mexican cinema experiences."
tt0106671,Darkness in Tallinn,1993,99,Ilkka Järvi-Laturi,"Comedy,Crime,Thriller","""DARKNESS IN TALLIN"" is a standout heist film praised for superb pacing, gritty cinematography capturing Baltic life in 2003's Tallin, and exceptional direction/composition; it delivers thrilling surprises but lacks the polish of contemporary blockbusters like OCEAN'S 11. Rent or Buy It Now!"
tt0292963,Before the Devil Knows You're Dead,2007,117,Sidney Lumet,"Crime,Drama,Thriller","A gripping crime thriller about financial desperation that delivers thrills with less violence compared to ""No Country For Old Men,"" featuring strong performances by Ethan Hawke as Hank Hanson and Philip Seymour Hoffman as Andy Hansen; an award-caliber film directed skillfully by Sidney Lumet following Kelly Masterson's script."
tt0908196,Forever Blue,2006,44,Jeannot Szwarc,"Crime,Drama,Mystery","The reviewer admires an exceptional Cold Case Season 1 episode for its emotional depth and character portrayal while appreciating unique storytelling elements like selective color use in flashbacks. The significant romantic subplot between two male officers amidst homophobic adversity is particularly praised as one of Emmy-worthy narratives, though not without some debate on story content."
tt0116953,Mad Dog Time,1996,93,Larry Bishop,"Comedy,Crime,Drama",The reviewer loves this unconventional comedy's wacky and surreal nature but finds it difficult to recommend due to its niche appeal; it's well-constructed with great humor despite lower acting expectations from a demanding plot.
tt0840094,Five Days,2007,60,"Otto Bathurst, Toby Haynes, Simon Curtis, Peter Hoar","Crime,Drama,Mystery",The reviewer praises a modernized five-part TV drama as one of their best experiences ever seen on any platform; they find its quality both inspiring to writers and entertaining despite some minor drawbacks like longer release intervals compared to weekly episodes.
